Tweet,HS,Abusive,HS_Individual,HS_Group,HS_Religion,HS_Race,HS_Physical,HS_Gender,HS_Other,HS_Weak,HS_Moderate,HS_Strong
"USER USER kalau saat itu NU ga bergabung dgn nasakom ,negara ini bakalan dikuasai komunis 100%\n\nmakanya mrk gagal menguasai NKRI Krn ada lawan yg terus menentang yaitu Nahdatul Ulama \n\npaham daki Dajjal?'",0,0,0,0,0,0,0,0,0,0,0,0
USER USER Pake wifi aja masih gembel',0,1,0,0,0,0,0,0,0,0,0,0
Pendahulu memengusir Cina 1 kota ! turun dan turun ke anak-anak skrg siloam di usir ! kapan boleh memengusir ? ketika kalian di injak2 !,1,0,0,1,0,0,0,0,1,0,1,0
mengelibut di pagi buta',0,0,0,0,0,0,0,0,0,0,0,0
USER Ih banci selotipan \xf0\x9f\x98\x82',1,1,1,0,0,0,0,1,0,1,0,0
USER Susu kntl manis = susu kental manis \xf0\x9f\x98\x83',0,0,0,0,0,0,0,0,0,0,0,0
"USER Pas masih audisi keknya, dia rambut panjang item terus sipit. Dia ngedancenya lincah bgt kek ulet bulu ngel ngel gt dahh\xf0\x9f\x98\xad\xf0\x9f\x98\xad\xf0\x9f\x98\xad'",0,0,0,0,0,0,0,0,0,0,0,0
USER Laki-Laki hebat untuk #2019GantiPresiden ????,1,0,1,0,0,0,0,0,1,1,0,0
jokowi ratu adil apaan..??? dia ga ada keturunan darah biruadanya DARAH KOTOR cina babi..!!! URL,1,1,1,0,0,1,0,0,0,1,0,0
"\xe2\x9c\xbe \xe3\x80\x95Nama Lengkap: Jung Hyemi.\n\n\xe2\x9c\xbe \xe3\x80\x95Nama Panggilan: Hyemi.\n\n\xe2\x9c\xbe \xe3\x80\x95Tempat, Tanggal Lahir: Busan, 3 Januari 1995.\n\n\xe2\x9c\xbe \xe3\x80\x95Golongan Darah: A.\n\n\xe2\x9c\xbe \xe3\x80\x95Aga",0,0,0,0,0,0,0,0,0,0,0,0
USER USER Ingin mengaduk aduk jateng kyk DKI.. ga mkn bisa.. kita dah pandai dan belajar dr pilkada jakarta..,0,0,0,0,0,0,0,0,0,0,0,0
"siapa Hepa? seperti Uzza dan saudarinya, hepa/heba/khepat ad dewi/ tuhan perempuan Mesopotamian, Hurrian. \n\nso, apakah orang ibrani-yahudi juga kasih nama anaknya dgn ""abd - "" ?'",0,0,0,0,0,0,0,0,0,0,0,0
"USER USER USER ~improvisasi itu lagu..al Qur'an itu tafsir..masak susah mikir gituan..murotal itu improv..Tilawatil Qur'an itu improv..raut mukamu itu tafsir..cara kentutmu itu tafsir..cara ngentot aja tafsir..cara kawin itu tafsir...ngaji yg bener.!!""",1,1,1,0,0,0,0,0,1,1,0,0
Mewoh Dampingi Gubernur OD Hadiri Acara Puncak Festival Paskah GFG 2018,0,0,0,0,0,0,0,0,0,0,0,0
"USER kafir zindiq itu kafir yg terpaksa jd Muslim krn keturunan, hukum syariah ma tekanan sosial (Islam KTP)'",0,0,0,0,0,0,0,0,0,0,0,0
partai sinting indonesia URL,1,1,0,1,0,0,0,0,1,0,1,0
USER anak kecil buta huruf\n\nhuft',0,0,0,0,0,0,0,0,0,0,0,0
Mereka tidak tertarik melihat KORUPTOR BLBI yg pelaku2nya Taipan binaan KOMUNIS CHINA dan mitra nya MEGAWATI SP,1,0,0,1,0,1,0,0,0,0,1,0
USER otw di bom korut u',0,0,0,0,0,0,0,0,0,0,0,0
"USER Propaganda agama selalu pembrontakan dipimpinUlama atau Ustaz.Tetapi buktinya tidak pernah ada ulama/ustaz yg ditangkap apalagi dibuang ke BovenDigul,.Yg ada adalah tahanan NASOMALISdan KOMUNIS.Ada bukti",0,0,0,0,0,0,0,0,0,0,0,0
"Dan dukungan terhadap GNPF Ulama Akan sangat berkurang,dan kita Akan Kalah di 2019..karena Aksi tangkap Busukmawati anget2 tai Ayam..; USER USER USER ; #2019gantipresiden; #2019gantipresiden; #2019gantipresiden; #2019gantipresiden; #2",1,1,1,0,0,0,0,0,1,1,0,0
"Emg susah yah kalau Club sama Supporternya Gak Pnya Mental, pasti dikit* lapor polisi. #Pecun&amp;g'",0,1,0,0,0,0,0,0,0,0,0,0
"USER USER Gembok akun aja udah..gak usah tebar data..berkali kali main data,lo gak bisa jawab data gembok akun..\xf0\x9f\x98\x82\nSehari 2 kali gembok akun...\nPayah cebong cupu..'",1,1,1,0,0,0,0,0,1,1,0,0
USER OIYA GEBLEK AUTO NYANYI',0,1,0,0,0,0,0,0,0,0,0,0
Wooyyy Njing!! ibumu pelacur ya pantesan kelakuan lu bejad! Dasar anak haram!! USER ckakakakak :D',1,1,0,1,0,0,0,1,0,0,1,0
okezonenews Penggunaan Anggaran Negara Jokowi: Banyak yang Ukuran Kinerjanya Tidak Jelas URL URL,1,0,1,0,0,0,0,0,1,1,0,0
"USER Blm pernah denger statement dari ulama manapn ""Memuja2 Ara ,tapi statement anti keara an sering banget, bahkn tdk pernah ada statement anti kechina""an, ke yahudi""an...kepanikan ingin hdp ala liberal...'",0,0,0,0,0,0,0,0,0,0,0,0
"USER Ciee orang kafir mau masuk surganya orang islam, tapi gak bisa, dan gak bakal bisa, silahkan cari surga lain, kalo ada \xf0\x9f\x98\x82'",1,0,1,0,1,0,0,0,0,1,0,0
"USER Pak USER tugas Anda lbh berat dari BNN, menyadarkan Muslim: solat, ngaji, zikir sama dgn ekstasi",1,0,0,1,1,0,0,0,0,0,1,0
"USER Pak Recep..............anda salah, itu gubernur pakkkk....bukan presiden ., presiden kami lagi di Got.... ; Nih liat kalo gak percaya...",1,0,1,0,0,0,0,0,1,1,0,0
USER Kelakuan batak kafir itu ya seperti si USER. Suka memecah belah umat.,1,1,1,0,0,1,0,0,0,1,0,0
Sebagai umat Islam rasa kecewa marah thdp rezim ini manusiawi krn ulama dikriminalisasi makin anti sampe kpnpun...sikap gue SaveUstadAlfian,1,0,0,1,1,0,0,0,0,0,1,0
"Namanya Arisha, atau kalian bisa memanggilnya Risha. Jangan tanya mengapa nama tengahnya agak asing, karena ibunya bilang itu adalah nama sebuah kota di Inggris. Arisha adalah anak tunggal, sehingga sejak kecil ia sudah terbiasa untuk hidup mandiri. \xe2",0,0,0,0,0,0,0,0,0,0,0,0
"USER USER Bani remason apa ga kesian kucing-kucingnya pak Harun Yahya kalo bapaknya dipenjara, sapa yang kasih makan.\nNgiahahaha...'",0,0,0,0,0,0,0,0,0,0,0,0
Beginilah Gencarnya Kampanye Jelang Pilkada - NET JATENG:,0,0,0,0,0,0,0,0,0,0,0,0
SBY+PRABOWO; #2019GantiPresiden menang mutlak ? Chopper balik ke solo; USER Om USER,1,0,1,0,0,0,0,0,1,1,0,0
"USER Makanya ada Gereja Kristen Jawa, Gereja Kristen Maluku dll.Dalam keberagaman,ajarannya tetap satu: Yesus sebagai Juruselamat. Lainnya cuma gimmick aja, malah seru kalau lg ada pekan budaya di gereja2 dan kt nyanyi lagu ibadah dalam berbagai baha",0,0,0,0,0,0,0,0,0,0,0,0
"Siang tadi,saya mengikuti Rapat Terbatas dipimpin Bpk Presiden USER yg tegaskan pentingnya publikasi #AsianGames2018 baik di media lokal maupun internasional.; ; Ini adl kerja bersama utk sukseskan event bergengsi.Mohon doa dan dukungan rakyat Indonesia",0,0,0,0,0,0,0,0,0,0,0,0
Monyet Turun ke Pemukiman Warga Cibadak Sukabumi-URL,0,0,0,0,0,0,0,0,0,0,0,0
"Penjahat perang Nazi Adolf Eichmann adalah arsitek ""Solusi Akhir"" ""Nazi paling dicari di dunia,"" memusnahkan orang-orang Yahudi dari Eropa.'",0,0,0,0,0,0,0,0,0,0,0,0
"Rizal Ramli: Jadi Presiden, Saya akan Tangkap 100 Orang Paling Berengsek",0,1,0,0,0,0,0,0,0,0,0,0
"""Keanekaragaman budaya, suku, agama, itulah sesungguhnya kekayaan kita,â?? tutur Djarot di hadapan peserta Rakercabsus PDI_Perjuangan Kota Gunungsitoli.; ; #GubernurZamanNow ; #DjarotSihar2 ; #SumutPilih2Djoss #DjarotSiharMenang #GunungSitoli #PDIPerjuangan",0,0,0,0,0,0,0,0,0,0,0,0
Ya hidup emang brengsek meskipun lo orang baik. URL,0,1,0,0,0,0,0,0,0,0,0,0
Gak habis pikir deh gmn kalo kunti itu bs masuk rumah. Gak berani bayangin gue... lo berani bayanginnya? \n\nEnd.',0,0,0,0,0,0,0,0,0,0,0,0
"Dagangan Islam Nusantara, lah ngapa baru rame skg?, dulu"" kemana aja?, And, semoga ada juga Kristen Nusantara dll yang berbau Nusantara..'",0,0,0,0,0,0,0,0,0,0,0,0
"Apalagi teriak Allah hu Barbar, rusak telinga Bung Fahri, kapan diskusi Buang Islam di DPR?",1,1,0,1,1,0,0,0,0,0,1,0
"Ayu Ting Ting Goyang Hot Dekat Raffi Ahmad, Nagita Slavina: Kampungan, Norak URL",0,1,0,0,0,0,0,0,0,0,0,0
RT USER: Dan kami tdk lupa apa yg dilakukan bapaknya Prabowo di era Sukarno. Melarikan diri URL,1,0,1,0,0,0,0,0,1,1,0,0
USER USER Enaknya di dalam memek',0,1,0,0,0,0,0,0,0,0,0,0
Dengan tuduhan Cina membawa Flakka ke Indonesia utk merusak generasi muda Indonesia.,1,0,0,1,0,1,0,0,0,0,1,0
"Kalau udah sange gini, enak maininnya.\n\nKita sebagai cewe juga jangan jijik.\n\nJANGAN JIJIK.\n\nKan mau cipokan enak tanpa grepe.'",0,0,0,0,0,0,0,0,0,0,0,0
&lt; Udah lama cuma nyentuh 500 kata. Najis buat yang penting gabisa ngetik panjang. &gt;',0,1,0,0,0,0,0,0,0,0,0,0
"6.Di Indonesia itu warga Hindu Nusantara tak pernah menjelek2 kan Hindu India, \nKatholik Nusantara tak pernah menjelek-njelekkan Katholik Vatikan, bahkan Syiah Nusantara tak pernah menjelek-jelekkan Syiah Iran; anehnya yg mengaku Islam Nusantara kok men",0,0,0,0,0,0,0,0,0,0,0,0
USER APA HUHUNGANNYA BEGO SM LESBI ANJIR',0,1,0,0,0,0,0,0,0,0,0,0
Dinamika politik hari ini adalah refleksi upaya koalisi SBY - Jenderal Merah dan TNI merebut Jokowi,1,0,1,0,0,0,0,0,1,1,0,0
USER SIAPA YANG COCOT \xf0\x9f\x98\xa4',1,1,1,0,0,0,0,0,1,1,0,0
I added a video to a USER playlist,0,0,0,0,0,0,0,0,0,0,0,0
Xenoglossophobia\nadalah fobia atau\nketakutan akan bahasa asing.',0,0,0,0,0,0,0,0,0,0,0,0
Bacot bat si kunyuk USER bikin tambah sayang dah ah URL,1,1,1,0,0,0,0,0,1,1,0,0
USER 11 GB raib dicuri oleh providernya sendiri USER kan kampret',1,1,0,1,0,0,0,0,1,0,1,0
RT USER: Kalau aku cantik tapi memek ku coklat kamu masih doyan gak?\n\n#ngentot #memek #kontol #sange #pagicrot',0,1,0,0,0,0,0,0,0,0,0,0
Perbanyaklah membaca CERDAS biar gak dicap goblok :v\n\n#just_kidding\nNB : hanya orang dengan IQ diatas rata-rata yang mengerti tulisan di atas :v',0,0,0,0,0,0,0,0,0,0,0,0
"Coba kalo prabowo,sampe level OB aja bakal disebut perannya,jokowi ini hanya klaim saja,turunkan!!! URL",1,0,1,0,0,0,0,0,1,0,0,1
Gubernur yang membuat bangga bangsa Indonesia,0,0,0,0,0,0,0,0,0,0,0,0
USER Legeslatif jancuk \xf0\x9f\x98\xa0\xf0\x9f\x98\xa0',1,1,0,1,0,0,0,0,1,0,1,0
"Bukan komunis kali yg coba dibangkitkan kembali, tapi rezim Orba sudah haus lagi",1,0,1,0,0,0,0,0,1,1,0,0
USER Udh eek gua',0,0,0,0,0,0,0,0,0,0,0,0
Ada sahabatku yg pulang dr Papua. Sebelumnya dia kerja disalh satu kontraktor yg mngerjakan infrastruktur yg sdang dibangun. Beliau cerita bnyak bagmna jauhnya ketinggaln rkyt kita Papua dibnding dgn wilyah lainnya di negeri ini. Syukrlah pk Jkwi jd presid,0,0,0,0,0,0,0,0,0,0,0,0
USER Apadong? Bom atom?',0,0,0,0,0,0,0,0,0,0,0,0
Pemerintah anti kritik Pemerintah anti Islam Pemerintah antek PKI Pemerintah antek Yahudi alasanbikinaksi kantaibanget,1,1,0,1,1,1,0,0,0,0,1,0
Njinggg!! Bencong banyak gayya... pke block2 wa.',1,1,1,0,0,0,0,1,0,1,0,0
USER Edan ini quote berbobot bwangeeeeeeuuut....',0,1,0,0,0,0,0,0,0,0,0,0
"USER ngapain di ingatkan orang tersebut.. wong yg di ingatkan budek, tuli, pekak dan tolol'",1,1,1,0,0,0,1,0,0,1,0,0
"USER USER truskan kedunguanmu bong, sampe bangsa ini tercabik2...tinggal saya pungutin saja sampah kaya' elo satu2...dasar mata sipit!""",1,1,1,0,0,1,0,0,0,1,0,0
bagus....nanti dipakai untuk petisi lengserkan Jokowi ya KembalikanAhokKeCipinang,1,0,1,0,0,0,0,0,1,1,0,0
"RT USER: Kelakuan homok jaman now, ngentot aja sambil live di Blued #gayvid #gvid #lokalhangat URL",0,1,0,0,0,0,0,0,0,0,0,0
"OpRohingya orang Kristen mmbunuh kita di Afghanistan orang Yahudi mmbunuh kita di Palestina tp""Muslim"" yg Teroris?",1,0,0,1,1,0,0,0,0,0,1,0
Para Bajingan yang telah melukai Lady harus menerima ganjaran seratus kali lipat!! -Sanji',0,1,0,0,0,0,0,0,0,0,0,0
Beri anak bangsa pendidikan yg baik jangan jadikan robot pe-nyembah2 Allah SWT yg merintahkan perangi & bunuh kafir,1,0,0,1,1,0,0,0,0,0,1,0
"Bentar lagi pilkada ya gaiis? Buat yg mau nyolok, omat ini mah gaiis! Kalo milih pemimpin itu yg sesuai mata hati, bukan sesuai mata uang!",0,0,0,0,0,0,0,0,0,0,0,0
USER \xe2\x80\x9clo cina ya?\xe2\x80\x9d tapi pake nada yg anu. hm. //',0,0,0,0,0,0,0,0,0,0,0,0
USER Untung aku ga dongo.g',0,0,0,0,0,0,0,0,0,0,0,0
"RT USER Bisa aja nih Gerindra bikin jebakan ""Batman"" knp ga Prabowo aja yg suruh nobar Film G30S.",1,0,0,1,0,0,0,0,1,0,1,0
"USER halaah pak pak ... yang gaduh itu kan cuma org2 spt bpk, skr ya tenang lah lapak udah dikuasai, tinggal bagi2 kue ke sesama gerombolan, kemaren kan pada kelaparan gk dapat apa pun, mau maling pun susah. ; ; rakyat makin parah. ;",0,0,0,0,0,0,0,0,0,0,0,0
USER Kayak komunis aja ga menghargai jasat manusia...cebong=komunis',1,1,0,1,0,1,0,0,0,0,1,0
USER USER KIRAIN BUDEK',0,1,0,0,0,0,0,0,0,0,0,0
#MataNajwaDebatJakarta topeng anda hari ini fix terbuka USER .. anda sama dgn yg mendukung anda.. BAU BUSUK,1,1,1,0,0,0,0,0,1,1,0,0
"USER KalauPRIBUMI iseng, aparat berwajah garang.... #Cina yang rasis, aparat jadi alay....'",1,1,0,1,0,1,0,0,0,0,1,0
USER: ahoker siap bela penista agama https:\/\/t.co\/HxuU4rUDFX\,1,0,0,1,0,0,0,0,1,0,1,0
"USER USER Yaamfun, skripsiku malah budaya populer:))",0,0,0,0,0,0,0,0,0,0,0,0
"USER Gilaaaa lu ndro___pelepasa\xc3\xb1 saham disamakan dgn proklamasi kemerdekaan,\nSaking pinternya merangkai kata atao keblinger niiih Bani Onta...'",1,1,0,1,0,0,1,0,0,0,1,0
USER diam kamu eek anakonda',1,1,1,0,0,0,0,0,1,1,0,0
kartu axis kaya kunyuk!!',0,1,0,0,0,0,0,0,0,0,0,0
USER Ente aja ga suksreb bajingan.',1,1,1,0,0,0,0,0,1,1,0,0
USER Niiih Sih Congor Onta_bego atao Goblok yaaa.... mau juga suara Congor Onta luuu dalam hal ini di Corong ke Polri___\nJaaaaaaaaaanCuuuuuuuuuuk',1,1,1,0,0,0,0,0,1,1,0,0
USER QUE BOM SBBSNSN',0,0,0,0,0,0,0,0,0,0,0,0
"Tai adalah, saat gue biasa aja, dia baik banget &amp; ngejar-ngejar gue. Eh pas gue udah sayang + nyaman, dia malah jadi cuek &amp; pergi gitu aja'",0,1,0,0,0,0,0,0,0,0,0,0
"Informasi yg kami sampaikan sejak 8 tahun lalu itu 99% terbukti akurat, telah dan sedang terjadi. RI jadi korban imperialism via proxy\n\nMengapa info tsb tdk efektif mencegah proxy war dan AWS konspirasi global? \n\nKrn Pemimpin tertinggi pada saat itu",0,0,0,0,0,0,0,0,0,0,0,0
USER USER USER USER USER Bubarkan dpr ?,1,0,0,1,0,0,0,0,1,0,0,1
RT USER: LINK BARU ! Yang ini nih baru Asli Bapak Indo yang nonton bakal ngaceng terus apalgi kalo download full video dari awal\xe2\x80\xa6',0,1,0,0,0,0,0,0,0,0,0,0
"RT USER: gausah munafik! kalo di hati lo benci ya benci aja jangan sok damai damai! kalo gue masih tetep ""VIKING itu ANJING""\n#Dilar\xe2\x80\xa6'",0,1,0,0,0,0,0,0,0,0,0,0
USER USER Tujuan dibikin kaca tuh biar nyadar pas kemaren lu ngehina ismed belom lagi dulu2 bepe sm diego michel (pbfc) tolol lu',1,1,1,0,0,0,0,0,1,1,0,0
"USER USER Tai lah,, kalo rakyat jelata sewenang- wenang kalian menderek,, giliran anggota DPRD eeemelawan,, mana buktinya kalo di mata hukum kita sama?..'",1,1,0,1,0,0,0,0,1,0,1,0
Selamat berbuka puasa buat jalani\nHongkong jumat harus dapat THR\nAi 2d top: 80319\nCb sekuatnyaa: 88833999\nMacau: 93 / 83 / 98\nSelamat meracik sesuai ai mu dan jp.\nMinat bom 2d 3d 6line tidakbb inbox saya bosku.buat yg percaya saya dan bisa dpercaya,0,0,0,0,0,0,0,0,0,0,0,0
Lebih aneh lagi lagunya tetap sama. Mic yg sama. Cuma itu doang.. Abang bisa apa,0,0,0,0,0,0,0,0,0,0,0,0
usss kok bloon banget sih mereka\xf0\x9f\x98\xad',1,1,0,1,0,0,0,0,1,0,1,0
USER Asing aseng aja itu cuma musim aja kali bang. Skg da musim baru lagi yaitu musim plesiran.',0,0,0,0,0,0,0,0,0,0,0,0
Ajib bener nih pak wakil gubernur ... ð??? baik banget dr sya meminta menyukai foto dengannya di instagram saya.,0,0,0,0,0,0,0,0,0,0,0,0
USER USER Hah lu maho? Sudah ku duga..',0,1,0,0,0,0,0,0,0,0,0,0
"RT USER: Lengkap sudah penderitaan\n\nGa bisa pakai kontol.\nPakai tangan\n\nPas pakai tangan, cewe nya kesakitan. URL",0,1,0,0,0,0,0,0,0,0,0,0
Lagi booming meme ini. Kemacetan adalah suatu hal yang abadi karena masih banyak yang mungut SIM di pos ronda. Idiot versus cerdas emang sangat mudah dibedakan. \xf0\x9f\x98\x85 URL,0,1,0,0,0,0,0,0,0,0,0,0
HALAH LU MAH BACOT ASU! PALING LU JUGA ANTEK ANTEKNY SI USER USER atau ini side accny? halah anjing',1,1,1,0,0,0,0,0,1,1,0,0
"Lagian budaya indonesia kan emg biasanya umur segini dipanggil kyk gitu jd gua wajar aja sih tp gatau lah tiap orang kan beda"" wkwk",0,0,0,0,0,0,0,0,0,0,0,0
"USER #kom3 menkumham : mengenai md3, memang benar hak imunitas itu ada. Pernah ada perdebatan uu pilkada, sdh ketok palu, namun pendekatannya presiden sdh mengeluarkan perpu. Namun md3 ini presiden tdk mengeluarkan perlu tp tdk mau tandatangan. Sy kira",0,0,0,0,0,0,0,0,0,0,0,0
Sepandai pandainya kita menyembunyikan bangkai pasti akan tercium juga baunya haha \xf0\x9f\x99\x8a',0,0,0,0,0,0,0,0,0,0,0,0
Sahkan #RUUMasyarakatAdat,0,0,0,0,0,0,0,0,0,0,0,0
USER Ingat PDI ingat komunis ya.?,1,0,0,1,0,1,0,0,0,0,1,0
"""Barangsiapa mengenal dirinya, maka ia akan sibuk memperbaikinya dengan tidak memerdulikan cacat dan aib orang lain.""\n\n- Habib Luthfi bin Yahya -'",0,0,0,0,0,0,0,0,0,0,0,0
hue mimpi gua buta asw amit2',0,1,0,0,0,0,0,0,0,0,0,0
USER Jablay gitu bazeng:((',1,1,1,0,0,0,0,1,0,1,0,0
RT USER: Perempuan Indonesia yg ber-Burqa atau bercadar harap dimusnahkan saja dr Indonesia pak USER USER USER,1,0,0,1,1,0,0,0,0,0,0,1
Warga Jkt minta pak USER Tdk melantik Anies Sandi krn sdh jelas mrk terlibat dlm lingkaran Saracen. Politic_ID,1,0,1,0,0,0,0,0,1,1,0,0
USER USER Kunti beranak dalam baskom?',0,0,0,0,0,0,0,0,0,0,0,0
"Nek bener 1,8T brrti yo bajingan tenan wonge.'",1,1,1,0,0,0,0,0,1,1,0,0
Ternyata kata2 antek aseng china hanya berlaku untuk pak Jokowi.nyatanya kalo uno yg mau impor dari china kampret diam dan hening\xf0\x9f\xa4\xa3\xf0\x9f\xa4\xa3',1,1,0,1,0,1,0,0,0,0,1,0
"semua diklaim sama bani bong\ndari yang paling toleran, paling pancasilais, paling bhinekais, paling aktivis, dan sampai paling islmis.\neealahh..\ndasar tutup botol penyok \xf0\x9f\x98\x82'",1,1,1,0,0,0,0,0,1,1,0,0
"Allah SWT halalkan harta rampasan malah janjikan banyak rampasan, Muslim harus Buang Islam sebelum teriak no korupsi",1,1,0,1,1,0,0,0,0,0,1,0
USER kek tai mencret anjir',0,1,0,0,0,0,0,0,0,0,0,0
USER USER USER Protestan dr Amerika? Katolik dr Roma? Begitukah?? Ada yg bs jawab? Krn setau saya tdk seperti itu...',0,0,0,0,0,0,0,0,0,0,0,0
"Miris, GP ga belajar dari kasus Ahok.",1,0,1,0,0,0,0,0,1,1,0,0
Macam ada orang asing dalam rumah\xf0\x9f\x99\x83',0,0,0,0,0,0,0,0,0,0,0,0
"USER USER Setuju bang, bom Surabaya spti berkah yg tersembunyi. Terbitlah UU Antiterorisme gerakan pembersihan mulai dilakukan, tpi tak ada artinya jika berganti rezim dlm waktu dekat.'",0,0,0,0,0,0,0,0,0,0,0,0
Dulu kelas menengah pilih jokowi dan lawan prabowo karena kasus HAM sekarang kok.... Hancur gini ya Indonesia,1,0,1,0,0,0,0,0,1,1,0,0
Orang cuma main bola dihubungkan ama agama; Bzz,0,0,0,0,0,0,0,0,0,0,0,0
USER USER USER USER USER USER USER USER Klo kodok sma macan asia ya ga level laaah ....beda kelasss jauuuh....cma org2 dongoook dan dungu yg mengelu2kan kodok si munafik',1,1,0,1,0,0,0,0,1,0,1,0
"Jika Ikuti Si Garong; Maka; ""Ajaran Agama Berdasar Fiksi""",0,0,0,0,0,0,0,0,0,0,0,0
HEH SINTING YA LU URL,1,1,1,0,0,0,1,0,0,1,0,0
USER Babi kaulahhh maju lu sini anjinggg!!',1,1,1,0,0,0,0,0,1,1,0,0
"RT USER USER USER USER USER Tidak ada yg menghina siapa-apa selain perbuatan seseorang itu sendiri, jadi coba lihat sikap bapak yang diktator",1,0,1,0,0,0,0,0,1,1,0,0
"yaudah atuh usir hindu budha juga aja biar gimana pun mereka nga monoteis. atau, tanyain aja dulu deh. tau arti kata ""esa"" nga sih?",1,0,0,1,1,0,0,0,0,0,0,1
RT USER USER Zaman pak SBY antek-antek PKI tdk merajalela mengganas seperti masa sekarang.,1,0,1,0,0,0,0,0,1,1,0,0
muka aku cantik tp burik;3',0,0,0,0,0,0,0,0,0,0,0,0
USER USER ngapain masuk sini setan',1,1,1,0,0,0,0,0,1,1,0,0
USER buat kader USER yg pekok... nih itung yg bikin tagar #2019GantiPresiden lebih dari 10.. tu congor jangan asal jeplak ye... bisa jadi 2019 moncong putih yg bakalan nyungsep.',1,1,0,1,0,0,0,0,1,0,1,0
"knp gak minta sekalian LENGSERKAN Jokowi, biar sekalian kelihatan GOBLOKnya !!!",1,1,1,0,0,0,0,0,1,0,0,1
"#GelangKode mereka anggap operasi intelejen. Dasar manusia fiksi dungu, sana belajar dulu ilmu intelejen.'",1,1,0,1,0,0,0,0,1,0,1,0
"Anda lapar sesaat, hidup mewah, di Suriah mereka hidup sengsara, sama2 karena Islam & Muhammad BEJAD dipercaya nabi",1,1,0,1,1,0,0,0,0,0,1,0
RT USER USER Bntr lg si joko jg nyungsep kyk ho ok. Nyantai aja kali.... Hehe,1,0,1,0,0,0,0,0,1,1,0,0
"USER USER Biar tak dikritik bila kita tambsh mesra dgn komunis cina, kan lg perang dagang ama AS.'",0,0,0,0,0,0,0,0,0,0,0,0
"Selamat Hari Kartini; ""Majulah Perempuan Indonesia"" #HariKartini #harikartini2018",0,0,0,0,0,0,0,0,0,0,0,0
USER KAFIR lah.. disini kan paling demen bilang kopar-kapir... \xf0\x9f\x98\x90\xf0\x9f\x98\x90\xf0\x9f\x98\x90',1,1,1,0,1,0,0,0,0,1,0,0
kejadian diatas bisa kita simpulkan bahwa rezim Jokowi hari ini memang anti Islam dan pro kapitalis. penghapusan Politic_ID,1,0,1,0,0,0,0,0,1,1,0,0
"USER Rezim nggilani, aneh, konyol. Dr kemarin acara rembuk aktivis 98 sampe yg ini, semua tontonan lawak. Yang semakin bikin ketawa, kedua acara dihadiri presiden.'",1,0,0,1,0,0,0,0,1,0,1,0
USER USER USER USER USER USER USER USER USER USER USER Bilangin wendy unnie suru jemput vider sebelum dia dijual mucikari',0,0,0,0,0,0,0,0,0,0,0,0
USER USER Gak sudi rakyat punya presiden jongos kacung Cina. Itu cuma presidennya cebong2 cina aja.',1,1,1,0,0,1,0,0,0,1,0,0
Jangan serahkan nasib Bangsa ini kepada orang-orang yg mengabdi (meng-kacungkan diri) ke cukong-cukong aseng pengkhianat NKRI yg jadi pemodal dana kampanye mereka.\n\n#2019GantiPresiden',1,1,0,1,0,0,0,0,1,0,1,0
USER USER Yg goblog itu adalah bani cebong tukang tipu penjilat penguasa yg ketahuan gerakin masa yg dibayar pakai nasi bungkus. Propaganda nasi bungkus memang selalu gagal.',1,1,0,1,0,0,0,0,1,0,1,0
USER mentil = nete? menyusui? mengemut?',0,0,0,0,0,0,0,0,0,0,0,0
"Selama Mukidi berkuasa, orang spt FA, Kodat, Bopeng, Nathan, dkk dijamin aman.; #2019GantiPresiden",1,0,1,0,0,0,0,0,1,1,0,0
USER USER Eh onta tolol. Kasihan org tua melahirkan seekor binatang seperti mu. Dasar kaum bumi dtr. PKS laknat',1,1,0,1,0,0,0,0,1,0,1,0
Di arab koruptor di potong tangan Di cina koruptor di potong kepala Di Indonesia koruptor di potong masa tahanan,1,0,0,1,0,0,0,0,1,0,1,0
"USER Dgn Ketua Umum PERSIS KH Aceng Zakaria di Bandung. Dulu Bung Karno belajar dgn Pendiri PERSIS A. Hasan, guru Natsir ð???",0,0,0,0,0,0,0,0,0,0,0,0
USER Kampang memang',1,1,0,1,0,0,0,0,1,0,1,0
"(cont.) kelamin wanita, terdengar memenuhi lokasi. Rasanya, setelah berubah wujud dirinya jadi lebih menjiwai perannya.\n\nDalam hati, ia mengutuk para pemburu atau orang-orang asing yang tiba-tiba saja mengejarnya bersama dengan timnya yang bertugas (co",0,0,0,0,0,0,0,0,0,0,0,0
"RT USER: Syarat untuk menggunakan Tai Chi, kudu tauk apa yg sedang dimainkan oleh lawan. Kudu tauk materi yg sedang dipergunakan oleh\xe2\x80\xa6'",0,0,0,0,0,0,0,0,0,0,0,0
"// Aduh lucu banget adek kelas gue pas SMA laporan katanya ""bang hari ini kita field trip ke Taman Safari, heran dah (nyebut 1 nama temennya dia) mau arisan ama keluarganya aja bawa 1 sekolahan.""\n\nTai, arisan.'",0,1,0,0,0,0,0,0,0,0,0,0
Pemkot Cirebon optimis mampu merekam 19.000 calon pemilih pemula yang masih berstatus pelajar SMA,0,0,0,0,0,0,0,0,0,0,0,0
"USER USER Komentator yg dungu ya ente bro... Lebih tinggi dungu nya dari pada otaknya, hahaha...'",1,1,1,0,0,0,0,0,1,1,0,0
"melati tak perlu berkata dirinya wangi, bunga bangkai tak akan berkata busuk baunya'",0,0,0,0,0,0,0,0,0,0,0,0
USER USER USER USER USER USER USER USER USER USER USER USER USER USER USER USER USER USER USER USER USER USER,0,0,0,0,0,0,0,0,0,0,0,0
RT USER USER Para partai oposisi zaman SBY menguasai media massa hingga berbagai prestasi SBY tidak dipublikasikan.,1,0,0,1,0,0,0,0,1,0,1,0
USER Kalo sehati cacat dong?: (',0,1,0,0,0,0,0,0,0,0,0,0
USER aku terlalu sipit jadi nda kebaca itunya',0,0,0,0,0,0,0,0,0,0,0,0
USER arahnya mau dibawa seperti pilkada DKI ya kang. ko jadi bahaya laten ya kalau semua pilkada dibikin kayak gitu..,0,0,0,0,0,0,0,0,0,0,0,0
"USER Sumpah ya paling gasuka sama orang norak gini. \nKalau pengen berisik, sewa aja tuh satu studio! Gatau diri. Udik ew'",1,1,1,0,0,0,0,0,1,1,0,0
"USER iya setiap buka kacamata, mata gua berasa lebih sipit dan kantong mata hitam banget'",0,0,0,0,0,0,0,0,0,0,0,0
Maju lu sini anjing URL,1,1,1,0,0,0,0,0,1,1,0,0
bahasa yang paling susah buat sulli adalah bahasa cina',0,0,0,0,0,0,0,0,0,0,0,0
USER USER USER USER USER USER USER USER USER USER USER USER USER USER USER USER USER USER USER USER USER USER Li,0,0,0,0,0,0,0,0,0,0,0,0
USER Jokowi tai asu',1,1,1,0,0,0,0,0,1,1,0,0
USER USER USER USER Wuih... cebong sewot...\n\xf0\x9f\x98\x82\xf0\x9f\x98\x82\xf0\x9f\x98\x82',1,1,1,0,0,0,0,0,1,1,0,0
USER Kluarga cebong kuadrat..yg cewek JIL sesat.. Satu Lagi LS hoak',1,1,1,0,1,0,0,0,0,1,0,0
Tahukah Anda apa persamaan antara malin kundang dengan Ahok? mereka berdua sama-sam DURHAKA!!!!!!! #ASBAK #iklanahokjahat #kampanyeahokjahat,1,1,1,0,0,0,0,0,1,1,0,0
Yang laporin abu janda ga salah bos tr bisa2 ente yg di laporin bro..,0,0,0,0,0,0,0,0,0,0,0,0
USER Kl dia kalah.. Pasti salah wasit.. Padahal dah pake isu hoax. Ulama 212. Saracen. Isu sara. Isu pki. Isu antek asing.. Semua dah goreng sampa hangus.. Ttp aja gak naik elektabilitaanya.. Salahnya?? Rakyat yg goblok y wowo? Atau km yg,1,1,1,0,0,0,0,0,1,1,0,0
"ini saya setuju, makanya dukung presiden yang sudah berupaya mengurangi kekuasaan asing, mengurangi ekspor mentah, mengganti kontrak yang merugikan Indonesia",0,0,0,0,0,0,0,0,0,0,0,0
USER eyyy kepala aku tak sebesar tuuu eue',0,1,0,0,0,0,0,0,0,0,0,0
"USER Aku jg gendut si nder tp ya drpd mikirin omongan orang lain mulu mending pelan pelan ngerawat diri,gapapa gendut asal bisa ngerawat diri maaah skrg aku pede pede aja sm diri aku sendiri yuhu'",0,0,0,0,0,0,0,0,0,0,0,0
Agar Muslim mudah Buang Islam USER USER USER Kemen.Agama wajib menjelaskan asal-usul kafir,1,0,0,1,1,0,0,0,0,0,1,0
Rezim Laknat si jokodok; #2019GantiPresidenBaru; #2019GantiPresiden; #2019AsalBukanJokowi,1,1,1,0,0,0,0,0,1,1,0,0
"Gak tahu malu ya.. gunakan uang rakyat untuk ""menyuap"" rakyat, demi elektabilitas.; #2019GantiPresiden",1,0,1,0,0,0,0,0,1,1,0,0
USER Kembang bangkai?',0,0,0,0,0,0,0,0,0,0,0,0
USER USER USER /matiin bom dengan classy/',0,0,0,0,0,0,0,0,0,0,0,0
"USER Setahu saya prambanan adalah candi hindu. (kelompok candi dieng, candi ungaran gedong songo dll). Borobudur adalah candi budha (kelompok sewu kalasan mendut dll).'",0,0,0,0,0,0,0,0,0,0,0,0
Media di Indonesia: Cina Komunis,1,0,0,1,0,1,0,0,0,0,1,0
USER spt ahok dulu .. nasdem disusul dg cs nya .. yg mendukung paslon penista agama dan tukang caci maki tai tai ..,1,1,0,1,0,0,0,0,1,0,1,0
"Pas lg makan dpt omelan itu rasanya seperti makan tai kucing dipagi hari.\nGak pake ngunyah, asal telen aja biar cpt abis ini sarapan'",0,1,0,0,0,0,0,0,0,0,0,0
Kekejaman umat budha di myanmar kejam dialah teroris sebenarnya URL,1,0,0,1,1,0,0,0,0,0,1,0
