Tweet,HS,Abusive,HS_Individual,HS_Group,HS_Religion,HS_Race,HS_Physical,HS_Gender,HS_Other,HS_Weak,HS_Moderate,HS_Strong
kenapa byk orang **** buta IT smh \xf0\x9f\xa4\xa6\xf0\x9f\x8f\xbb\xe2\x80\x8d\xe2\x99\x80\xef\xb8\x8f',0,0,0,0,0,0,0,0,0,0,0,0
"USER USER USER USER USER USER USER USER USER USER USER USER Bilangnya anti asing, aseng...nda taunya.... Wkwkwkwkwk'",0,0,0,0,0,0,0,0,0,0,0,0
"USER wkwk mampus lo jung, ruby'",1,1,1,0,0,0,0,0,1,1,0,0
USER ya allah sejak kapan lu jadi babi dek??!!!! \n\ngpp ini maljum..giliran gue jaga lilin',0,1,0,0,0,0,0,0,0,0,0,0
"Harus dijelaskan, mengaji dan solat juga budaya Arab Saudi setelah Muhammad menguasai jajirah Arab",0,0,0,0,0,0,0,0,0,0,0,0
USER USER USER klu KPK di bubarkan.. Kita sebagai rakyat wajib/kudu bubarkan wakil rakyat/DPR,1,0,0,1,0,0,0,0,1,0,0,1
Alumni 212 PKS dan tim sukses anies Sandi rame-rame buang body tak mengenal asma Dewi,1,0,1,0,0,0,0,0,1,1,0,0
"USER USER USER Bak sampah jerman sdh anis diresmikan, blm? Wc keliling gunting pitanya ya, nis.'",1,0,1,0,0,0,0,0,1,1,0,0
"USER Jele lo, udik.'",1,1,1,0,0,0,0,0,1,1,0,0
RT USER yg banyak bicara itu USER trus yg bakar sekolah gimana?? URL,1,0,1,0,0,0,0,0,1,1,0,0
"*lagi jalan2 ke ptc*\n\nAyah : ada pameran. Ayo\nAq : ayo. Pameran apa?\nAyah : pameran budha-budha gt.\nAq : (dalam hati) hmmm kalo ayah mah masih cocok2 aja kesana, mukanya masih ada chinese2nya -_-'",0,0,0,0,0,0,0,0,0,0,0,0
RT USER: Setiap memek cewek itu beda.\nmemek USER beda juga.bulu nya juga gak begitu.gak ada yang tau gimana.yg tau cuman paca\xe2\x80\xa6',0,1,0,0,0,0,0,0,0,0,0,0
"Dan sekarang kembali ditahan paksa dengan tuduhan kasus berbeda, mengerikan rezim jokowi URL",1,0,1,0,0,0,0,0,1,1,0,0
RT USER USER iya pak gapunya tpi akun hutang negara kita sjak loe yg mimpin udh ngalah2in gunung sahari,1,0,1,0,0,0,0,0,1,1,0,0
"Mungkin TGB bermaksud baik dgn dukung Jokowi, tp jgn lupa kasus fiktiF TGB dimaki2 di bandara Singapura oleh WNI Tionghoa (tokoh fiktif).'",0,0,0,0,0,0,0,0,0,0,0,0
RT USER: CSIS pembohong jangan harp menang 2019 cuih URL,1,0,1,0,0,0,0,0,1,1,0,0
USER Ngentod yuk saynk',0,1,0,0,0,0,0,0,0,0,0,0
"USER USER USER USER USER Eh toilet fifis onta melipir lagi. Ini di indonesia lho, gerombolan lu mabok budaya arab jd nya kayak gitu \xf0\x9f\x98\x82'",1,1,0,1,0,0,0,0,1,0,1,0
Mulut mu bauk tai.anti korupsi tapi ingin bubarkan KPK.ente dari PKS.Dan PKS itu sahabat KOMUNIS. URL,1,1,1,0,0,1,0,0,0,1,0,0
pemerintahan Gus Ipul dan Puti ke depan akan memperkuat program Nawacita Presiden Jokowi di Jawa Timur. #RakyatB3rsamaJKW,0,0,0,0,0,0,0,0,0,0,0,0
"USER ini bhya bisa2 perkataan ade armando mempengaruhi muslim yg msih awam bisa tercuci otaknya, kata ustadz syaitu mrip dgn yg namanya JIL, perang pemikiran lbih berbahaya dibandingkan dgn perang fisik klau kalah perang fisik kta bsa syahid kalo klh p",0,0,0,0,0,0,0,0,0,0,0,0
USER USER Tolol jijik',1,1,1,0,0,0,0,0,1,1,0,0
"Memang ,,,nafsu seks tu,membutakan segalanya,termasuk ketika lg sange,,,titit bau kencurpun rasa keju,,,,,\n\n#yg merasa aj ya'",0,1,0,0,0,0,0,0,0,0,0,0
"USER Iya kan dia minta klarifikasi, kalo masih di deny, hantam aja dsr terkutuk'",1,1,1,0,0,0,0,0,1,1,0,0
Eropa punya Slavia Brothers\nOrtodox Power\nMelayu punya Malay Brothers\nIslam Power\nEropa : Fundamentalis kristen ortodoks garis keras\nMelayu : Fundamentalis Islam Garis Keras',0,0,0,0,0,0,0,0,0,0,0,0
"udh mau masuk kerja malah mencret"" begini. capenya kan kemaren\xf0\x9f\x98\xa2'",0,0,0,0,0,0,0,0,0,0,0,0
USER USER Pki bangkit??',0,0,0,0,0,0,0,0,0,0,0,0
"ini semua berawal dari AHOK JAMBAN yg dibela aparat, para kristen serta china kafir yang lain semakin berani menghi URL",1,1,0,1,1,0,0,0,0,0,1,0
"USER USER USER Pintar tapi itu tugas utama pemerintah, coba blajar lagi tugas utama dpr'",0,0,0,0,0,0,0,0,0,0,0,0
Dan jangan munafik kita butuh visual yg wow untuk menarik yg non-fans. Maka dari itu we need Yireon Sakura Wonyoung Yoonjin lagipula mereka gak cuma jual tampang doang Terbukti mereka sukses jadi center dan suaranya juga oke',0,0,0,0,0,0,0,0,0,0,0,0
USER Yang bener lo lee? Teorinya USER kalo netflix season 2 kacrut makin terbukti nih\xf0\x9f\x98\x82',0,1,0,0,0,0,0,0,0,0,0,0
"Dalam kesempatan tersebut, Presiden juga mengucapkan selamat kepada guru-guru yang hadir karena mereka telah bersertifikasi. Tercatat ada 500 guru yang hadir pada acara ini.'",0,0,0,0,0,0,0,0,0,0,0,0
USER USER USER USER USER Anda yakin budha idn agama impor? dari mana? Candi tdk identik dgn negara budha mana pun. Dann berada di tengah pulau. Sdgkan yg lain mempunyai kampung tua ditepi laut...\nKearifan lokal yg,0,0,0,0,0,0,0,0,0,0,0,0
USER oiii pada niat ga sih nanganin keluhan pelanggan ? udah 4 hari keluhan ga ditanggepin. Bangke abis',1,1,0,1,0,0,0,0,1,0,1,0
"Niat mau elegan dgn puisi, malah menampilkan kenorakan &amp; kedunguan. Semua jg bangga dgn budaya Indonesia, apa2an menyerang agama? Kampungan! URL",1,1,1,0,0,0,0,0,1,1,0,0
"USER USER USER Celengnya tereak2 cebong tolol. Padahal celeng lbh dungu, nih buktinya. \n\n2019 kita ganti presiden yuk\nSetuju bang, tp siapa gantinya? \nTolol masih nanya, kita cari dulu koplak. \nO gitu ya bang. \n\nNah, klo kt roc",1,1,0,1,0,0,0,0,1,0,1,0
Indonesia dalam cerita; ada anggota DPR yang nunggak bayar listrik.; ada Anggota DPR yg jualan kaos.; Ada anggota DPR yg ingin ganti presiden dg kaos.; ; yg lebih parah lagi Rakyat yg Goblog ingin ganti presidenya dg tagar doang.; sangat lucu dan pantas di,1,1,0,1,0,0,0,0,1,0,1,0
Pemerintah Diminta Cabut Perpes Tenaga Kerja Asing,0,0,0,0,0,0,0,0,0,0,0,0
"USER Dlu jaman aku kuliah, ada menu dr ampas tahu, ga enak. Di magelang dimasak apa mz?'",0,0,0,0,0,0,0,0,0,0,0,0
USER USER dasar tolol.',1,1,1,0,0,0,0,0,1,1,0,0
#TGBuntukINDONESIA2019; #TGB TERUS PROMOSIKAN PARIWISATA HALAL YG MENDUNIA.; Cover TGB Tuang Guru Bajang #2019gantipresiden,0,0,0,0,0,0,0,0,0,0,0,0
"Apakah Anda jujur, percaya Allah SWT perintahkan penggal kafir adalah Tuhan, Pak Lukman?",1,0,0,1,1,0,0,0,0,0,1,0
"USER \xc2\xa6\xc2\xa6 Orang asing.\n\nOke itu dua kata :')""",0,0,0,0,0,0,0,0,0,0,0,0
"RT USER: kesel bat wa liat yg terlalu parnoan terus bikin video viral, ternyata dugaannya justru yg keliru.\n\nTipikal yg kalo nyebar h\xe2\x80\xa6'",0,0,0,0,0,0,0,0,0,0,0,0
"Semangat Terus Pak USER. ; Kantor Staf Presiden Harus Terdepan Publikasikan Semua Kegiatan Presiden Supaya Rakyat Tau Bahwa Presiden Kerja Keras Membangun Bangsa ini, kerja.. kerja.. kerja; USER USER; USER USER",0,0,0,0,0,0,0,0,0,0,0,0
USER USER Kalo sekedar foto doang mah anak idiot kek lu gitu bisa \xf0\x9f\x98\x82\xf0\x9f\x98\x82',1,1,1,0,0,0,1,0,0,1,0,0
Chaser top Jogja mana aja NIH ? #gay #Grindr #growlr #gayboy #gaychaser #gayindo #GayIndonesia #lokalhot #gaylokal #gaytop #chubbyguy #gaybear #gaybottom #kontol #SANGE_AAAAAAAAAAH #gayjogja #gayasia #gayfitness #gayyogyakarta #gayasia',0,1,0,0,0,0,0,0,0,0,0,0
"Dari Rakyat biasa pada umumnya dan masih tetap bersahaja meski sdh jadi Presiden, kecuali semangat nya yg luar biasa untk Indonesia",0,0,0,0,0,0,0,0,0,0,0,0
RT USER DPR bubarkan saja gak ada gunanya utk bangsa. Pertahankan KPK,1,0,0,1,0,0,0,0,1,0,0,1
bener banget ke indahan alam budaya dan segala hal yg terkaitnya #JokowiSayangiPapua,0,0,0,0,0,0,0,0,0,0,0,0
RT USER USER Dan hebat nya GK ada yg teriak antek cina,1,0,1,0,0,1,0,0,0,1,0,0
Warbiasak presiden USER ð???ð???,0,0,0,0,0,0,0,0,0,0,0,0
RT USER USER Dudukan boleh DPR mantan menkominfo tp posting hoax hadehhh doa pak jokowi endut gagalpaham,1,0,1,0,0,0,0,0,1,1,0,0
Yesung adalah seorang Katholik',0,0,0,0,0,0,0,0,0,0,0,0
"Saya sudah wanti wanti supaya itu dokter tobat tetep aja ga bisa, ngapain pernah seorganisasi katolik sama saya kalau akhirnya ke Universitas Kristen?'",0,0,0,0,0,0,0,0,0,0,0,0
USER Gamau dia ga maho/?',0,1,0,0,0,0,0,0,0,0,0,0
USER USER USER .\nOnta mati klo kebanyakan Minum',1,0,0,1,0,0,0,0,1,0,1,0
"Presiden Boros dan Foya-Foya, Rakyat Menderita. ; ; Jokowi Presiden Pilihan Taipan ; ; Cc. USER USER ; ; #2019GantiPresiden",1,0,1,0,0,0,0,0,1,1,0,0
"Para pembajak agama ini intoleran dan reaktif, mereka terbiasa menggunakan agama sebagai badik untuk menusuk lawan duniawinya. Tapi mendadak toleran ketika keyakinannya dihina oleh kawan duniawinya. ; Ya, mereka memang gunakan agama untuk mengejar tujuan2",1,0,0,1,1,0,0,0,0,0,1,0
lulusan S1 mrka panggil prof -&gt; USER ; Ketum partai mrka panggil presiden -&gt; USER ; Org gk bisa ngaji mrka panggil ustad -&gt; USER ; Sang pemborong kasus tersangka mereka panggil ulama -&gt; USER ; ; Ini namanya Du,1,0,0,1,0,0,0,0,1,0,1,0
Atas bujukan setan hasrat yang dijebak zaman',0,1,0,0,0,0,0,0,0,0,0,0
"""Orang yg berkata pada saudaranya, \'hai kafir\', maka ucapan itu bisa ditujukan pada org tersebut atau org yg mengucapkan"" - H.R. Muslim #bot'",0,0,0,0,0,0,0,0,0,0,0,0
USER Pasti harga akan naik...konsumsi turun tidak ideal lgi...ekonomi gak tumbuh...huuft,0,0,0,0,0,0,0,0,0,0,0,0
USER USER USER USER CEBONG rata2 sama GOBLOKnya dgn USER \xf0\x9f\x98\x82\xf0\x9f\x98\x82\xf0\x9f\x98\x82',1,1,0,1,0,0,0,0,1,0,1,0
"Moga Koalisi pak USER bs lebih bijak dlm menentukan siapa Bakal Calon Wakil Presiden mendampingi PS ke Pilpres 2019.; ; Saran saya tdk hrs dari partai koalisi, bisa dari tokoh lain yg lbh menjual dan memiliki nilai elektoral tinggi. Ayo saling Legowo;",0,0,0,0,0,0,0,0,0,0,0,0
"Kemaren beli ayam. Udah dipotong, tapi lama banget matinya tuh ayam. \nEh.. Masih kejet2, sama si tukang ayam langsung di rendam di air panas. Aku protes gak mau beli. Tp dia memelas. \nYa udah, aku bayar. Tapi aku buang ayamnya. Masak makan bangkai\n\nSYARIAH ISLAM HARGA MATI!'",0,0,0,0,0,0,0,0,0,0,0,0
USER jancuk kw zonk!!!!',0,1,0,0,0,0,0,0,0,0,0,0
"USER Begokkkkkk. Dasar otak onta, pikiran mesummm.. rakyat yg sdh kecekik ekonomi makin dicekik dg pajak semakin tinggi. Tp pemda DKI dan DPRD foya2 dgn duit pajak'",1,1,0,1,0,0,0,0,1,0,1,0
"hideyoshi, nobunaga, ieyashu. \nyang paling banyak diremehkan adalah hideyoshi. \ntapi dia yang bisa membuat burung ""bisu""pun bersuka bernyanyi untuknya.\n\nsemoga engkau paham, sayang.'",0,0,0,0,0,0,0,0,0,0,0,0
"Warga Baduy setelah selesai memperingati tradisi Seba di Pendopo Pemkab Lebak akan dilanjutkan kembali bertemu dengan Gubernur Banten Wahidin Halim hari ini,Â Sabtu (21/4) #SebaBaduy2018; ; Im",0,0,0,0,0,0,0,0,0,0,0,0
Memonopoli gula dengan alasan penyebaran distribusi. Kami bukan orang bodoh pak presiden. Jangan bunuh IKM krn ada 298M biaya fee lelang.,1,0,1,0,0,0,0,0,1,1,0,0
"Kalo dia butuh, baek nya kayak malaikat yg nempel kayak ulat jambu. Sekalinya gw yg butuh minggat kayak ga punya dosa... Brengsek banget kan?'",1,1,1,0,0,0,0,0,1,1,0,0
"USER Aku pawanf monyet, aku pawangnya dia monyetnya'",0,1,0,0,0,0,0,0,0,0,0,0
"Apes beneeeer... dapet jadwal shift pagi cuma 4 hari. Besok off, lusa shift malam sampai Sabtu depan !! Badan makin cungkring, ampuuuun... Zzzzzz'",0,0,0,0,0,0,0,0,0,0,0,0
Mbak Sylviana please Anda sehat? #DebatFinalPilkadaJKT #perjuanganbelumselesai,1,0,1,0,0,0,0,0,1,1,0,0
RT USER USER Ada yg aneh dgn bpk USER klo KPK di bubarkan yg OTT maling2 rakyat Siapa???,1,0,1,0,0,0,0,0,1,1,0,0
pltl sorry rl ada yg kristen mau masuk grup dm?',0,0,0,0,0,0,0,0,0,0,0,0
"#BeritaIslam : Rizal Ramli: Pasca Gubernur Baru, DKI Jakarta Lebih Sejuk dan Tenang",0,0,0,0,0,0,0,0,0,0,0,0
USER haha akun pler. Jangan culun berlindung dibalik akun fans club. \xf0\x9f\x98\x9d',1,1,1,0,0,0,0,0,1,1,0,0
panwaslu kec kota kediri menghimbau untuk mensukseskan pilkada diwilayah kota kediri:,0,0,0,0,0,0,0,0,0,0,0,0
Tapi apa aku tahu.. \nRamai hanya mampu bisu.. \nTak mahu buang malu.. \nTakut kepala tembus peluru..',0,0,0,0,0,0,0,0,0,0,0,0
Karna dia ga punya program hanya modal bacot doang,1,1,1,0,0,0,0,0,1,1,0,0
â??Fabi ayyi alaâ??i Rabbikuma tukazziban â?? ; Alhamdulilah Nikmat Tuhan Manalagi yg akan kalian Dustakan ð???ð??? #HaturNuhunJokowi #2019TetapJokowi,0,0,0,0,0,0,0,0,0,0,0,0
Ganyang PKI....!!! URL didepan gedung LBH JAKARTA URL URL,1,0,0,1,0,1,0,0,0,0,0,1
"Dia nge-fans berat tuh ama Justin Timberlake, Usher. Kalo yang dari korea dia suka DBSK, Suju, Shinhwa, n Kim Tae Hee'",0,0,0,0,0,0,0,0,0,0,0,0
USER USER USER USER USER USER USER USER USER USER USER USER USER Pelabur asing dh sedar sejak awal lagi.\nHilang keyakinan dlm pentadbiran rejim #PHiraun.\n\nBr,0,0,0,0,0,0,0,0,0,0,0,0
USER iya juga ya pertanyaan bg USER ini. lantas kami menyebut org yg bkn beragama islam dgn sebutan apa? knp sebut non muslim gk terima. aneh2 aja rezim ini.. zaman pak beye dulu gk ada yg kek beginian. #TepokJidat. ya sdh la intinya #20,0,0,0,0,0,0,0,0,0,0,0,0
"Penyerapan dana desa pada tahun 2015 dan 2016 diprioritaskan untuk pembangunan infrastruktur. Di tahun 2017 ini, menurutnya penyerapan dana desa diprioritaskan untuk percepatan ekonomi desa. #Jokowi2Periode",0,0,0,0,0,0,0,0,0,0,0,0
"USER yg diancam untuk dibunuh itu presiden republik Indonesia mas, trus mesti lapor dulu? apakah penegak hukum gak bisa bertindak jika ada ancaman pembunuhan kepada kepala negaranya?'",0,0,0,0,0,0,0,0,0,0,0,0
"USER basmi dulu punya lu, malah merhatiin org lain si onta :)'",1,1,1,0,0,0,0,0,1,1,0,0
Amin yaa Rabb,0,0,0,0,0,0,0,0,0,0,0,0
USER Emang loe siapa cebong ???',1,1,1,0,0,0,0,0,1,1,0,0
"Narasinya tetang kehidupan dia yg pernah dialami dan sedang dialami apa yg mau diharap dari calon pemimpin seperti ini. Lihat Gubernur Jabar USER tdk banyak narasi tapi kerja hasilnya luar biasa banyak penghargaan, bandara Kertajati diklaim org diam",0,0,0,0,0,0,0,0,0,0,0,0
"USER Ini poltak bener2 manusia berwatak babi, jaman USER gencar bela sampai cocotnx itu monyong klo ngomong, skr USER di sanjung2 bak dewa. Skr sy tanya sm kau poltak babi, saat BBM naik tanpa penjelasan bahan pokok naik, TKI di pancung, kemana cocotmu'",1,1,1,0,0,0,0,0,1,1,0,0
"7. Terakhir, adakah tips untuk para #updaters tentang time management yg efektif sebagai mahasiswa? USER #KUchat",0,0,0,0,0,0,0,0,0,0,0,0
USER Saya juga heran dulu anda keliatan pintar tp sejak jd bani onta keliatan b*go nya',1,1,1,0,0,0,0,0,1,1,0,0
"USER 6. kandungan bahan alami (lidah buaya dll)\n7. tidak bersentuhan langsung dengan luka.\n\nAloClair juga telah dipercaya konsumen di 57 negara, jadi tidak diragukan lagi khasiatnya.'",0,0,0,0,0,0,0,0,0,0,0,0
"USER \xe2\xa0\x80\n\xe2\xa0\x80\xe2\xa0\x80\xe2\xa0\x80\xe2\xa0\x80 \xe3\x80\x8c Saya! Saya! Yang dulu bisu, kini sudah bisa bagi cuap-cuap! \xe3\x80\x8d'",0,0,0,0,0,0,0,0,0,0,0,0
"USER Baca aja Mas, baca sebelah istri kali aja abis baca langsung eue.\n\nHE HE.'",0,1,0,0,0,0,0,0,0,0,0,0
USER USER Kegedean pipi apa emg matanya sipit yaaa hmm ...\xf0\x9f\x98\x82\xf0\x9f\x98\x82\xf0\x9f\x98\x82',0,0,0,0,0,0,0,0,0,0,0,0
USER Cebong mana ngerti wkwkw',1,1,0,1,0,0,0,0,1,0,1,0
Jokowi yg harus mundur dari kursi presiden,1,0,1,0,0,0,0,0,1,1,0,0
Ganyang PKI DaruratPKI,1,0,0,1,0,1,0,0,0,0,0,1
Paparan Kapolres Bikin Kapolda Kepri Yakin Pilkada Tanjungpinang Aman dan Netral,0,0,0,0,0,0,0,0,0,0,0,0
"6. Presiden juga mengingatkan soal regulasi yang menghambat pelaksanaan berusaha, baik di Kementerian, di tingkat provinsi, di tingkat kabupaten, di tingkat kota. Presiden minta sekali lagi untuk dipangkas sebanyak-banyaknya dan disederhanakan.#ratas",0,0,0,0,0,0,0,0,0,0,0,0
"#SidangAhok smg sipenista agama n ateknya matinya tdk wjar n jasadnya tdk dtrma tnh n dia tdk prnh mrs kn sorga,aamiin semoga tuhan setuju",1,1,0,1,0,0,0,0,1,0,1,0
"USER Aku sekolah negeri dari SD-SMA. Tapi, aku juga enggak pernah mengalami ditanya agamanya apa, karena, kan sudah ada datanya. Teman-teman Kristiani, Hindu, dan Budha pun mendapatkan pelajaran agama ketika kami yang Muslim sedang mapel agama Isl",0,0,0,0,0,0,0,0,0,0,0,0
Benarkah YM masuk lingkaran istana rezim sekarang ? ... Kalau memang benar musibah bagi umat islam ... Karena ternyata banyak penghianat demi urusan dunia',0,0,0,0,0,0,0,0,0,0,0,0
USER Namanya jg agama munafik...',1,1,1,0,1,0,0,0,0,1,0,0
USER Haduhhh haduhhh belajar gembel dari siapa',0,1,0,0,0,0,0,0,0,0,0,0
Insya Allah Presiden..aaamiinn,0,0,0,0,0,0,0,0,0,0,0,0
"Jangan terlalu banyak berharap, nanti bisa sarap'",0,1,0,0,0,0,0,0,0,0,0,0
Prancis vs Belgia di babak pertama masih 0 - 0.\n\nAda sedikit persamaan dg bani cebong..\n\nApaan tuh?\n\nBani cebong/kacung otaknya juga 0 (kosong)!\n\n^_^\n\n# WorldCup2018 \n#GantiPresiden2019',1,1,0,1,0,0,0,0,1,0,1,0
Buku Biografi Alfian Ibrahim Diluncurkan -,0,0,0,0,0,0,0,0,0,0,0,0
USER USER Maklum Partai Komunis Sejahtera.',1,0,0,1,0,0,0,0,1,0,1,0
"trs kl ada bacot bacot di grup, kl dia udh ngomong, pasti pada setuju semua'",0,1,0,0,0,0,0,0,0,0,0,0
RT USER: Stw singaraja suka kontol URL,0,1,0,0,0,0,0,0,0,0,0,0
bodo amat mentab gua gak terselamatkan',0,1,0,0,0,0,0,0,0,0,0,0
"iklanahokjahat Terorist nyata di Indonesia... Bukan wahabi, bukan Onta Tapi Babi Babi milik Cina Penebar Teror sesungguhnya....",1,1,0,1,0,1,0,0,0,0,1,0
"USER GUA MAU MANDI DULU BYE, MAU NABUNG JUGA DI JAMBAN'",0,0,0,0,0,0,0,0,0,0,0,0
"Ulama adalah mereka yg memiliki kedalaman ilmu, yg melihat dan menyikapi masyarakatnya dengan kasih sayang.; ; Mari muliakan mereka..",0,0,0,0,0,0,0,0,0,0,0,0
USER USER USER USER USER USER Kkkkkkkkkkkkkk; Bong200 koq sama sprti junjunganmu sdh dungu plonga plongo lagi....; #2019GantiPresiden,1,1,0,1,0,0,0,0,1,0,1,0
Yup... Negara ini sangat tak pantas dipimpin seorang yg tak faham mengelola Negara dgn benar lengserkan jokowi,1,0,1,0,0,0,0,0,1,0,0,1
Pecun.kelas teri nih\xf0\x9f\x98\x80 URL,1,1,1,0,0,0,0,1,0,1,0,0
"USER USER USER USER USER ooh cuma"" gara"" beda pendapat langsung di pecat ya, kalau gtu rejim skarang anti kritik dong ,tdk mau ada masukan dari luar parlemen'",0,0,0,0,0,0,0,0,0,0,0,0
"""""Tidak peduli apakah kucing itu berwarna hitam atau putih, yang penting bisa menangkap tikus."" Deng Xiaoping (1904-1997), pemimpin Partai Komunis China ""'",0,0,0,0,0,0,0,0,0,0,0,0
"2. Presiden minta dengan menggunakan model registrasi yang lebih modern, cepat, sistem data yang terpadu dan terintegrasi sehingga tidak perlu lagi melewati banyak rantai birokrasi. #ratas",0,0,0,0,0,0,0,0,0,0,0,0
Gubernur Indonesia.,0,0,0,0,0,0,0,0,0,0,0,0
Jagalah kesehatan berpikir dan berlogika yang benar dengan #2019GantiPresiden,1,0,1,0,0,0,0,0,1,1,0,0
"USER Gak2 mar aku guyon anjir, awm nek delok twt ku rausa risih yo aku biang cocot hehe'",0,1,0,0,0,0,0,0,0,0,0,0
"USER USER USER USER USER USER ape gw di ajarin dan ditanggapin sama guru trus ,.. guru gw bego gitu ,... doniiii luh ma anak TK samaaaa pinteran juga kali anak TK ,.. luh cuma jadi anjing2 yg di suruh melolong di time li",1,1,1,0,0,0,0,0,1,1,0,0
USER USER USER USER HTI EMANG PERLU DI BUBARKAN,1,0,0,1,0,0,0,0,1,0,0,1
"Kak...kak...kak...kak...pd manggil kak semua, kyk lg ngeladeni adek2 imut culun di bawah umur, males ahh'",0,1,0,0,0,0,0,0,0,0,0,0
"abam pres badar n nuqaba pling boekkkð???, dia ni hebat dlm bidang agama, x tkut nk tgur member sndiri, n selalu wat lawak hambar (yg pling aku ingt smpai skrg lawak dia klau org ckp jom gerak skrg dia akn gerakkn badan dia yg chubby tu)ð???,",0,0,0,0,0,0,0,0,0,0,0,0
MashaAllah.. indahnya melihat kedua tokoh tersebut. ; ; Allahu Akbar,0,0,0,0,0,0,0,0,0,0,0,0
"Pilkada Serentak 2018, Sumut Jadi Contoh Demokrasi di Indonesia Kata HMI",0,0,0,0,0,0,0,0,0,0,0,0
"USER USER ... INGIN JADI TKI, DEMI INSTA STORY MEWAH DAN INDAHHHHH \xf0\x9f\x98\x82\xf0\x9f\x98\x82\xf0\x9f\x98\x82\xf0\x9f\x98\x82\xf0\x9f\x98\x82\xf0\x9f\x98\x82\xf0\x9f\x98\x82'",0,0,0,0,0,0,0,0,0,0,0,0
USER Pak sandi ingin bilang....jgn bully lg pakai aseng asing... krn kita itu memang butuh negara lain termasuk china.',0,0,0,0,0,0,0,0,0,0,0,0
USER emang ahok siapa?? Orang penting?? Dia hanya penista agama!!,1,1,1,0,1,0,0,0,0,1,0,0
lagi jadi pendengar dialog yahudi dan israel versi katanya katanya \xf0\x9f\x98\xb3\xf0\x9f\x98\xb3',0,0,0,0,0,0,0,0,0,0,0,0
Saracen teraflisiasi dng geng anies Sandi tak terbantahkan,1,0,0,1,0,0,0,0,1,0,1,0
"USER Wkwkwk, ke trigger jg bani onta'",1,1,1,0,0,0,0,0,1,1,0,0
"Di Maroko, Anies Dipanggil â??Super Gubernurâ??",0,0,0,0,0,0,0,0,0,0,0,0
USER USER USER Teras saksi bisu ya MasDie.\n\nDuh khawatir sama keadaan Dicka nih',0,0,0,0,0,0,0,0,0,0,0,0
Kalau SBY dulu ngebut tarik utang kayak Jokowi ekonomi tumbuh tdk 63% bisa 7% atau di atas 7%. Ngelola negara kok andalin utang china?,1,0,1,0,0,0,0,0,1,1,0,0
USER USER Orang2 bego kebanyakan minum &amp; makan kotoran onta ...otak nya somplak',1,1,1,0,0,0,0,0,1,1,0,0
Gubernur Jatim Targetkan Jembatan Widang Selesai H-15 Lebaran,0,0,0,0,0,0,0,0,0,0,0,0
USER Jinyoung lah paling cocok \xf0\x9f\x98\x82\n cyn banyak tulisan thai di komentar sama latin. Aku berasa bacain komentar di mv gatse. Malah ada yg war antek inces sama antek eonni. Inces kaya kantip loh apa apa diakuin credits ke dia.',0,0,0,0,0,0,0,0,0,0,0,0
USER Berasa punya monyet :v .g',0,0,0,0,0,0,0,0,0,0,0,0
USER USER USER USER BODAT KOMUNIS TOLOL kau',1,1,1,0,0,1,0,0,0,1,0,0
AB seorang yang selalu berusaha keras untuk berhasil dalam pekerjaannya,0,0,0,0,0,0,0,0,0,0,0,0
"USER Makanya itu, tapi aku asal jawab aja masih. Bloon ya. : "" ('",0,1,0,0,0,0,0,0,0,0,0,0
"Krn mereka ingin mengganti Demokrasi Pancasila dgn Demokrasi PKI, yg tdk bertuhan, yg bebas perjinahan, miras, LGBT. PKIBukanIndonesia",1,0,0,1,0,1,0,0,0,0,1,0
USER OHH SI KUNYUK ITU',0,1,0,0,0,0,0,0,0,0,0,0
RT USER: \xe2\x9c\x8dinstagram:fanyaclarisha\n\xf0\x9f\x93\xb2wa+6281294490616\nUdah lama gk di entot sama brondong lokal. Enak jug entotanya\n\xf0\x9f\x91\x8ddont forget #r\xe2\x80\xa6',0,1,0,0,0,0,0,0,0,0,0,0
"Telah berlangsung pernikahan di kepala saya: Teknologi, Alam, dan Budaya. Sekiranya akan lahir keturunan yang membuat sesiapa saja ternganga ð???",0,0,0,0,0,0,0,0,0,0,0,0
"USER USER Dimana pun, yg menggunakan sistem pemilihan langsung, incumbent selalu diuntungkan. Oleh karenanya masa jabatan presiden dibatasi. Kalo tdk bisa2 32 th dipimpin oleh satu presiden.",0,0,0,0,0,0,0,0,0,0,0,0
Derita nun jauh disana akan sama dirasakan perihnya oleh saudara muslim lainnya.; Ummat islam itu bersaudara dan akan saling bantu jg saling mendoakan,0,0,0,0,0,0,0,0,0,0,0,0
"USER Wah kita sama nih, tp please jgn putus asa ya sama badan kamuu!! Klo aku punya prinsip ""cewe gendut itu imut"" karna ga semua cewe cantik/manis bisa dapetin ke imutan. Sdgkan klo imut kadang bisa cantik jugaa. Semangatt!\xf0\x9f\x92\x9c'",0,0,0,0,0,0,0,0,0,0,0,0
"Dia itu buaya darat sejati | B: Napa? | A: Liat aja, kaosnya Lacoste, sandalnya Crocs, celana kolornya Crocodile. #benerkan?'",0,0,0,0,0,0,0,0,0,0,0,0
USER Terkutuk engkau.',1,1,1,0,0,0,0,0,1,1,0,0
"Daya beli turun, data kemiskinan di olah2, harga2 naik tak terjangkau, kebutuhan hidup rakyat makin sulit, kesenjangan semakin lebar, hutang bengkak tak karuan, bagi2 jabatan terus terjadi, aset negara di jual2. TKA banjir. Dll.",1,0,1,0,0,0,0,0,1,1,0,0
"USER bolot, idiot, berisik, lawak, kocak, moodbooster tp wkwk'",0,1,0,0,0,0,0,0,0,0,0,0
USER pdhl gampang yak klo gak mau disebut kafir ya udh syahadat aja',0,0,0,0,0,0,0,0,0,0,0,0
"USER Sebenernya cebong, eh berudu, seolah ter-fait accompli...anies nyapres atau tetap gubernur, hidup mrk tetap ga tenang. Nikmat bgt gw dah klo lg begini buat mainin cebong.'",1,1,0,1,0,0,0,0,1,0,1,0
Nama: Rizieq Shihab Status: Tersangka Kasus: Konten Pornografi (diduga) Mendukung Anies-Sandi,1,0,1,0,0,0,0,1,0,1,0,0
USER USER USER scene edan \xf0\x9f\x98\x85\xf0\x9f\x98\x80\xf0\x9f\x98\x85\xf0\x9f\x98\x80\xf0\x9f\x98\x85\xf0\x9f\x98\x80\n\ntnggal 18 may tanggal keramat',0,1,0,0,0,0,0,0,0,0,0,0
USER Sejak bila hg pki hitam',0,0,0,0,0,0,0,0,0,0,0,0
USER USER - sekolah di sekolaan kristen\n- gak mesantren\n- kuliah di LIPIA (yaysn wahabi)\n- 2X dipenjara\n- ceramah dukung isis dan anggap sodar\n- kabur dr kasus hukm.\nNgaku IB umat islam??? Allooowwww umat yg mana?',1,0,1,0,1,0,0,0,0,1,0,0
USER Sarap tidur lagi enak si wkwk',0,1,0,0,0,0,0,0,0,0,0,0
RT USER Kebijakan om jokowi yg diktator bukan wajah lugu nya om.,1,0,1,0,0,0,1,0,0,1,0,0
USER Hancurkan PDIP...beserta antek 2nya....kumpulan kafirun munafikun....',1,1,0,1,1,0,0,0,0,0,0,1
USER USER USER USER USER USER USER USER USER USER USER USER USER USER USER USER USER USER USER,0,0,0,0,0,0,0,0,0,0,0,0
Pendaftaran Capres untuk #Pilpres2019 saja belum dibuka sampai Agustus 2018...yang normatif begini politikus PDIP masih belum paham? #2019GantiPresiden !!,1,0,0,1,0,0,0,0,1,0,1,0
USER USER USER USER Menarik untuk menengok sikap institusi2 negara thdp tuduhan jokowi adalah komunis dan china.',0,0,0,0,0,0,0,0,0,0,0,0
USER Kampret juga mau kasar n bandit di NKRI ntr semua Orang Cina di usir rakyat Indonesia biar tau rasa,1,1,0,1,0,1,0,0,0,0,1,0
"Jokowi Restui WNA Duduki Jabatan Direksi BUMN, Rizal Ramli: Ampun Deh!",0,0,0,0,0,0,0,0,0,0,0,0
"USER USER Keliatan tukang pijat nya gk punya bf kayk saya,, jd doyan kontol kayk begitu'",0,1,0,0,0,0,0,0,0,0,0,0
"Cinta itu memang buta, tapi jangan sampai ia memilih yang salah.'",0,0,0,0,0,0,0,0,0,0,0,0
"USER USER kaum cebong dungu, saham itu soal pengambilan keputusan mayoritas, bukan dapat keuntungan lebih banyak..\nemangnya siapa yg gaji pekerja, yg punya alatnya,? semua dari freeport..'",1,1,1,0,0,0,0,0,1,1,0,0
RT USER: #OpenBoSurabaya USER\nmasih online aja kau\nsempak\nakun tipu2 bangsat\nbajingan kai',1,1,1,0,0,0,0,0,1,1,0,0
USER Alhmdulillah...bang hasil polling google kemarin,0,0,0,0,0,0,0,0,0,0,0,0
"Agama kristen sudah mati, sejak abad pertengahan, disapu oleh bankir rentenir Yahudi. Pendeta mereka mengatakan Tuhan itu satu dari tiga.",1,0,0,1,1,0,0,0,0,0,1,0
USER USER USER Pakai memek hua hahaha',0,1,0,0,0,0,0,0,0,0,0,0
USER Yuk nete',0,1,0,0,0,0,0,0,0,0,0,0
"Pas ditegur duluan baru deh ngeh, itupun matanya harus pake di sipit sipitin dulu buat menerka nerka siapa yaa ini yang negur\xf0\x9f\x98\x82 wkwk'",0,0,0,0,0,0,0,0,0,0,0,0
"Sampai bila-bila hati tak akan bersih dengan melihat orang dengan mata yang merendahkan martabat orang lain. Whats worst, thinking you are any better than them. Perangai hampir sama dengan iblis.'",0,1,0,0,0,0,0,0,0,0,0,0
USER Iyaaa sayangkuuu sipit',0,0,0,0,0,0,0,0,0,0,0,0
"Buta greetings, gimana dong? Hehe'",0,0,0,0,0,0,0,0,0,0,0,0
