Tweet,HS,Abusive,HS_Individual,HS_Group,HS_Religion,HS_Race,HS_Physical,HS_Gender,HS_Other,HS_Weak,HS_Moderate,HS_Strong
Usir Dubes Myanmar dr Negri ini. Ksh peringatan ummat Budha di neg kita agar mrk menghimbau utk menghentikan penyiksaan kpd umat Islam dsna.,1,0,0,1,1,1,0,0,0,0,0,1
"USER Ancaman bom dari mata sipit, juga lucu2an ya... ?\n\n#LUCULUCUAN'",1,1,1,0,0,0,1,0,0,1,0,0
Pria Belanda Ini Jadi Mualaf Usai Ikuti Perjalanan Islam Nusantara Oleh NU di Eropa,0,0,0,0,0,0,0,0,0,0,0,0
USER Jancuk jancuk',0,1,0,0,0,0,0,0,0,0,0,0
USER Eh nurull kuliah dimana? Jurusan apa? Ha bahasa mandarin? Berarti kerja sama dong sama komunis ? Wah masih saudaraan dong sama g30spki',0,0,0,0,0,0,0,0,0,0,0,0
"Baca berita ormas yang mau ngelaporin pembacaan puisi oleh Ganjar Pranowo (karena dianggap menistakan agama) tapi ga jadi karena baru tahu itu ciptaannya Gus Mus, malah bikin keinget nonton final AFF 2010.",0,0,0,0,0,0,0,0,0,0,0,0
USER sedih gw baca komenannya nyalahin army taunya akun bodong. kampret dah.',0,1,0,0,0,0,0,0,0,0,0,0
Saya yakin pemerintahan Gus Ipul dan Puti ke depan akan memperkuat program Nawacita Presiden Jokowi di Jawa Timur. Salam 2 jari #GusIpulPutiSantun,0,0,0,0,0,0,0,0,0,0,0,0
USER Anjing menggonggong anies jalan terus,1,1,1,0,0,0,0,0,1,1,0,0
"harusnya pemerintah Indonesia mengeluarkan RUU Anti Budha, biar budha di Indonesia di usir dari Indonesia",1,0,0,1,1,0,0,0,0,0,1,0
"Kenapa gua jijiq? Gua mandangnya sebagai ""ORANG AWAM YANG GAK SUKA KPOP""! jadi mikir ""kan org korea tuh HOMO atau LESBI"" pdhl tuh idol kita mah di korea hidup tentram normal dan gua yakin sih bbrp idol udh punya pacar jadi wajar aja selama masih lawan je",0,1,0,0,0,0,0,0,0,0,0,0
Kapan punya program begini pak USER ditunggu pak...,0,0,0,0,0,0,0,0,0,0,0,0
OpRohingya Kristen membunuh di Afghanistan Yahudi membunuh di Palestina Islam membunuh dimana? Malah dicap teroris. Mikir,1,0,0,1,1,0,0,0,0,0,1,0
"USER Cara untuk mengosongkan masjid dengan jamaahnya, khas ala komunis.. \xf0\x9f\xa4\x94'",0,0,0,0,0,0,0,0,0,0,0,0
Mobile langend memang babi anjeng xnk kasi naik rank kimakkk team Noob babi bocahh setan',1,1,0,1,0,0,0,0,1,0,1,0
USER Bukan onta. Buroq itu kendaraan kita ke surga. Yaila',0,0,0,0,0,0,0,0,0,0,0,0
"Nah admin belanja satu lagi port terbaik nak makan Ais Kepal Milo, Ais Kepal Horlicks atau Cendol Toping kaw kaw. ð??­; ; Doket mano tu ? Gerai Rojak Mertuaku - Taipan 2 (depan TWINS BABY &amp; ROMANTIKA / Bank Islam Senawang) ð???",0,0,0,0,0,0,0,0,0,0,0,0
USER Kelamaan jomblo nanti jablay :(',0,1,0,0,0,0,0,0,0,0,0,0
"Cinta itu memang buta, tapi jangan biarkan ia memilih yang salah.'",0,0,0,0,0,0,0,0,0,0,0,0
"#RRIBantenPagiIni; ; Diduga Masalah Ekonomi, Seorang Guru SD Nekat Gantung Diri",0,0,0,0,0,0,0,0,0,0,0,0
"Su Pin siswi SD Katolik Karya Yosef Kelas 6B, 1983, istrinya Ronaldo Pardede yang sah.'",0,0,0,0,0,0,0,0,0,0,0,0
hestek tandingan dr #PersibTakutMainDiJakarta nggak nyambung dg fakta yg beredar .\n#VikingAnjing\n#PerSSIb\n#persLIB\n#LigaIndonesiaBandung\n#BotolKosong nyaring bunyinya macam congor mereka \xf0\x9f\x98\x82\xf0\x9f\x98\x82\xf0\x9f\x98\x9d\xf0\x9f\x98\x,1,1,0,1,0,0,0,0,1,0,1,0
"3. Presiden USER menyampaikan bahwa dalam waktu dekat ini akan digelar 171 pemilihan kepala daerah (pilkada) secara serentak baik pilkada gubernur, bupati dan wali kota #JokowiAjakUlamaSejukkanPilkada",0,0,0,0,0,0,0,0,0,0,0,0
Apakah ini HOAX?? colek USER USER USER,0,0,0,0,0,0,0,0,0,0,0,0
PapaMintaKetuaFraksi rakyat mau nya setya novanto keluar dari dpr bukan di pecat dari ketua dpr percuma saya di pecat dan masih ada di dpr,1,0,1,0,0,0,0,0,1,1,0,0
USER kalo saya ketawa sipit dua duanya? itu kenapa?',0,0,0,0,0,0,0,0,0,0,0,0
USER Gue terus terang buat kasus bom gak percaya 100%. Tapi knp juga sekarg gak bisa 100% satu suara sama lu sperti dulu. Bnyak yg hilang. Ya mungkin lagi bulan puasa bulan yg baik untuk hijrah.',0,0,0,0,0,0,0,0,0,0,0,0
Program18: Melindungi sepenuhnya seluruh produk warisan budaya / ekspresi budaya tradisional dan hak cipta para seniman. USER #Asyikm3nang #Asyikm3nang,0,0,0,0,0,0,0,0,0,0,0,0
Tak ada persatuan dengan para PKI. Silahkan rekonsiliasi dengan cebong yang dungu sekolam.,1,1,0,1,0,0,0,0,1,0,1,0
USER Banci bgt anjg mantan lo',1,1,1,0,0,0,0,1,0,1,0,0
"Mari ingatkan sekaligus dukung pemerintah, utk tetap kelola ekonomi &amp; kesejahteraan rakyat, meskipun kita berada di tahun politik *SBY*",0,0,0,0,0,0,0,0,0,0,0,0
USER Apa lagi memek yg ga ada bulunya lebih mantap di jilatnya',0,1,0,0,0,0,0,0,0,0,0,0
USER Perbedaan itu harus terbiasa dalam alam Demokrasi sekarang ini...jangan Orang2 Rezim yg sekarang ini pro Penguasa...gerah gitu dgn perbedaan ...Dulu juga Partai yg sekarang berkuasa sering kok demo..kritik..',0,0,0,0,0,0,0,0,0,0,0,0
"RT USER: Main layangan\n\n\xf0\x9f\x91\xa6 benang kuat kan, takut putus nanti\n\n\xf0\x9f\x91\xa8 ga mungkin putus, kita jarang berantem\n\n\xf0\x9f\x91\xa6 tai\n\n-gobs'",0,1,0,0,0,0,0,0,0,0,0,0
"USER USER Udah gak bisa nangkep kalimat dari awal, sok pinter sekolam. Pake ngata2in islam, Kasihan banget temen cebong lo yang islam, udah mah mati2an belain cebong kapir. Gak taunya agama islam di hina2 sama cebong kapir nih satu hahaha nas",1,1,0,1,1,0,0,0,0,0,1,0
Saya suka video USER URL Awal Kisah Perseteruan Haji Bolot &amp; Malih Tongtong',0,0,0,0,0,0,0,0,0,0,0,0
USER Cewe gila. Sinting. Freak',1,1,1,0,0,0,1,0,0,1,0,0
"USER kalau pemahaman ana Hina disitu pandangan diri kita tehadap tuhan besar kepala takabur. Sombong.. Pada zat nya air yang d maksudkan suci.. Allah juga mngangkat drajat manusia pada mahluk tertinggi dibanding malaikat, jin, iblis dan hewan.'",0,0,0,0,0,0,0,0,0,0,0,0
"LINMAS WILAYAH TAWANGSARI, BULU &amp; WERU TERIMA PEMBEKALAN PAM PILKADA SERENTAK",0,0,0,0,0,0,0,0,0,0,0,0
"muke lu katrok, tampang & kelakuan sinkron",1,1,1,0,0,0,1,0,0,1,0,0
USER USER USER Yang mulai ngatain cebong juga kaum codot....playing victim much?',1,1,0,1,0,0,0,0,1,0,1,0
USER Iya edan kaya lu',1,1,1,0,0,0,1,0,0,1,0,0
#2019GantiPresiden scra konstitusional itu hak setiap rakyat woii! . Gini nih kalo klo planga plongo tp kelakuan otoriter.,1,1,1,0,0,0,0,0,1,1,0,0
"Dlm agama Kristen, kita diajarkan tdk boleh saling menghakimi....silahkan, jika diperbolehkan pd agama sobat",0,0,0,0,0,0,0,0,0,0,0,0
Nama: Andi Taufan Tiro Status: Terpidana Kasus: Korupsi Mendukung Anies-Sandi,1,0,1,0,0,0,0,0,1,1,0,0
Sudahkah Anda Di Tipu Jokowi Hari Ini ?,1,0,1,0,0,0,0,0,1,1,0,0
"Ini baru ""BERITA""; ; PPP TOLAK PENCAPRESAN JOKOWI...!; ; 1. Baru Didukung PDIP, PPP Tolak Jokowi Menjadi Presiden Dua Periode; ; Partai Persatuan Pembangunan (PPP) kubu Djan Faridz dengan tegas menolak Jokowi kembali memimpin Indonesia untuk dua periode. ð???",0,0,0,0,0,0,0,0,0,0,0,0
"USER Sama kayak papaku\xf0\x9f\x98\x82\n\n'apa manggil2? mau nete?'""",0,1,0,0,0,0,0,0,0,0,0,0
USER Kok ganti namanya jd hatstag ð???ð???ð??? pengen bgt ganti presiden ganteng yað???,0,0,0,0,0,0,0,0,0,0,0,0
"Pada momen kegiatan budaya ini, telah direncanakan akan ada ribuan warga Baduy yang membanjiri Kota Serang.; #ExcitingBantenOnSebaBaduy; ; #GenpiCilegon",0,0,0,0,0,0,0,0,0,0,0,0
"2. Dalam rapat terbatas ini, Presiden USER mengingatkan pentingnya publikasi terhadap kegiatan yang akan diselenggarakan di Jakarta dan Palembang pada bulan Agustus mendatang #JokowiPacuPromosiAsianGames #YukPromosikanAsianGames18",0,0,0,0,0,0,0,0,0,0,0,0
"USER kyknya itu titit nya di sambung, trus pake accessoris jg'",0,1,0,0,0,0,0,0,0,0,0,0
Rejim Jokowi otoriter ini maksa banget harus pake non tuney.,1,0,1,0,0,0,0,0,1,1,0,0
"USER Itu bisa terwujud dikarenakan katolik itu terpusat,terstruktur,teroganisasi dng sangat baik yakni berpusat pada vatikan. Jadi Nu bisa mengambil,merebut peran seperti vatikan maka semua akan lebih mudah'",0,0,0,0,0,0,0,0,0,0,0,0
"USER Kampret nih si Jimmy...loe dapet duit dari niru2 ulama, ulama malah loe goblog2in. Loe yg goblog bin Bahlul. Mendingan loe copot tuh atribut2 palsu loe, ganti seragam cebong.....loe bakalan mati sengsara di adzab sama Allah. Aamiin\n Loe liat aje nanti...'",1,1,1,0,0,0,0,0,1,1,0,0
RT USER: USER Kenapa pada jadi IDIOT semua ya???\nApakah ini azab dari Allah. ???',0,1,0,0,0,0,0,0,0,0,0,0
"USER Foto profile nya saat naik pesawat, tp msh bs blg jgn cintai produk asing,dari hal sederhana ini saja,kita sdh bs mengukur berapa parahnya tingkat kemunafikan mu,lbh baik anda lgs terjun dari pesawat biar ucapan anda sesuai dgn perbuatan.",0,0,0,0,0,0,0,0,0,0,0,0
"USER Lagi cerita-cerita gitu..\n\n\xf0\x9f\x91\xa6 iya kalo di kristen kan ada Rabu Abu, Kamis Putih, Jumat Agung..\n\xf0\x9f\x91\xa9 sabtu?\n\xf0\x9f\x91\xa6 jalan yuk..\n\nAuk amatttttt\xf0\x9f\x98\x82\xf0\x9f\x98\x82\xf0\x9f\x98\x82'",0,0,0,0,0,0,0,0,0,0,0,0
"Pndukung USER spt ARB, SDA adl org2 BEJAD tabiatnya kasar termasuk org ini &gt;&gt; USER &lt;&lt; DASAR Anjing!!'",1,1,0,1,0,0,0,0,1,0,1,0
Mana sempet mimpi lagi gw bangke',0,1,0,0,0,0,0,0,0,0,0,0
"Bangsa ini harus berani membahas secara terbuka dan beradab, Islam bukan agama, melainkan ajaran sesat yang merugikan",1,1,0,1,1,0,0,0,0,0,1,0
Karakter kartun yang mendeskripsikan karakter Luhan adalah \xe2\x80\x9cRaja Monyet diDragon Ball\xe2\x80\x9d karena mereka berdua memiliki rasa keadilan XD',0,0,0,0,0,0,0,0,0,0,0,0
USER USER Love mindun dan antek anteknya \xe2\x99\xa5\xe2\x99\xa5\xe2\x99\xa5',0,0,0,0,0,0,0,0,0,0,0,0
USER USER Sampean sarap ya..kl impor pswat terbg gak pa2.. ini impor garam. Gk kebayang indonesia yg isinya garam semua kok garam jgdiimpor ...dasar otak ente ampu kaki',1,1,1,0,0,0,0,0,1,1,0,0
USER USER Jd ingat congor oknum Nasdem klo si joko kalah di 2019 Indonesia bubar,1,1,1,0,0,0,0,0,1,1,0,0
"Belum pernah ada pelatih asing yang menjuarai Piala Dunia. Yang terbaru, Roberto Martinez (melatih Belgia), juga gagal di semifinal.'",0,0,0,0,0,0,0,0,0,0,0,0
Pagi pagi sudah galau\n\nGalau ke kampus ikut try out atau tidak\n\nNanti di tengah2 mencret kan ga lucu :(',0,0,0,0,0,0,0,0,0,0,0,0
"Jika kasus yang menjerat umat islam polisi berlaku cepat, giliran si penista Al - Quran kayanya lambat banget Penjarakan penjarakan ahok",1,0,0,1,1,0,0,0,0,0,1,0
USER USER Tipiwan tipi favorit kaum fiksi yg dungu \xf0\x9f\x98\x84\xf0\x9f\x98\x84\xf0\x9f\x98\x84',1,1,0,1,0,0,0,0,1,0,1,0
USER USER Bisa ular juga protein. Enzim babi juga.',0,0,0,0,0,0,0,0,0,0,0,0
"Ini nih, gue jg suka gitu. Abis gue sm temen2 gue beli, org beli juga. Ini gara2 gue yg gendut (jd keliatannya suka makan dan selera gue bagus, gitu kali ya) bisa jadi bikin pandangan orang oh makanannya enak, makanya mereka ikut beli LOL HEHE URL",0,0,0,0,0,0,0,0,0,0,0,0
USER Gak krungu bocoran aseng milan arep rekrut pemain argentina ta mbah (emanuel de porras) \xf0\x9f\x98\x82\xf0\x9f\x98\x82',0,0,0,0,0,0,0,0,0,0,0,0
KPK masih dibutuhkan. Semua yg dilakukan sdh baik. Knp tdk DPR saja yg di bubarkan? URL,1,0,0,1,0,0,0,0,1,0,1,0
"\xf0\x9f\x91\xa6: Dek, ak cinta kamu. Ak mencintaimu karena ALLAH \xf0\x9f\x99\x8f\n\xf0\x9f\x91\xa7: Iyamas .ak jua mencintaimu,tapi.\n\xf0\x9f\x91\xa6: Tapi ap lagi? ak wes hijrah rajin ngibadah wes pinter ngaji, wes siap rabi\n\xf0\x9f\x91\xa7: Tapi m",0,0,0,0,0,0,0,0,0,0,0,0
USER ngomong ama silit',0,1,0,0,0,0,0,0,0,0,0,0
USER Pasti cebong ikut2 an gelas nya ada gambar 5 priode cebong\xf0\x9f\x98\x82\xf0\x9f\x98\x82\xf0\x9f\x98\x82',0,1,0,0,0,0,0,0,0,0,0,0
MENGAPA ahoker KRISTEN & MUNAFIK tidak berhenti mengolok2 GEREJA stiap hari? Apakah mereka memang dibriefing ahok untuk menghina si BUMI DATAR?,1,1,0,1,1,0,0,0,0,0,1,0
USER U gataw waktu taun baru dia valik lg tai bgt',0,1,0,0,0,0,0,0,0,0,0,0
USER Bangke \xf0\x9f\x98\x82\xf0\x9f\x98\x82\xf0\x9f\x98\x82',1,1,1,0,0,0,0,0,1,1,0,0
Gubernur Jabar HEBAT!ð???ð???,0,0,0,0,0,0,0,0,0,0,0,0
Posting Gambar Jokowi dan Megawati di Atas Ranjang Eko Prabowo Ditangkap. JokowiAgain,1,0,1,0,0,0,0,0,1,1,0,0
USER USER USER USER USER USER USER Minta tolong sama USER buat blejetin ni pilot sontoloyo. Buat USER tlg kami minta klarifikasinya.',1,1,1,0,0,0,0,0,1,1,0,0
Peh. Cha Tae Hyun kalau berlakon. *menitik air mata*',0,0,0,0,0,0,0,0,0,0,0,0
"Katekismus Gereja Katolik tidak melarang miras secara lantang tapi menentang perbudakan yang bisa disebabkan oleh miras. \n\nBeberapa ayat menyatakan anggur secara positif (Pengkotbah, Mazmur dan Amos) seperti: minumlah anggur dengan hati yang senang da",0,0,0,0,0,0,0,0,0,0,0,0
"USER USER USER Dan cebong pun terdiam. Taunya apple to apple doang, istilah yang bikin katanya keliatan pinter tapi minim kognitif'",1,1,1,0,0,0,0,0,1,1,0,0
RT USER USER Para jendral propaganda mereka perang propaganda dgn jualan utamanya pki dan cinaisasi..,1,0,0,1,0,1,0,0,0,0,1,0
USER USER Lidah buaya.',0,0,0,0,0,0,0,0,0,0,0,0
USER Mampus lu anaknya langsung nongol',1,1,1,0,0,0,0,0,1,1,0,0
Emangnya nih partai klo ngeluarin statement ada yang percaya? Lah isinya jongos cina komunis semua.,1,1,0,1,0,1,0,0,0,0,1,0
Ih geblek sp yg bilang airplane pt.2 bawa2 islam alquran sgala \xf0\x9f\x98\xa1\xf0\x9f\x98\xa1 lebih ke latin drpd arabic song kali \xf0\x9f\x98\xa7',0,1,0,0,0,0,0,0,0,0,0,0
USER baru baca sarap kali',0,1,0,0,0,0,0,0,0,0,0,0
kesel tai army kepalanya gede2 bener URL,0,1,0,0,0,0,0,0,0,0,0,0
"USER udah jelek, budek lagii :( .nga'",1,1,1,0,0,0,1,0,0,1,0,0
E-Commerce â??Nyawa Baruâ?? Pertumbuhan Ekonomi RI,0,0,0,0,0,0,0,0,0,0,0,0
"perempuan kaya lo mending mati aja deh, jelek aja, gausa sok jadi make up artist!",1,1,1,0,0,0,1,1,0,1,0,0
"USER USER Keadilan .. Bilang ke org laen anti aseng, giliran akun medsosnya diblokir, demooooooo... Nyinyiiiiiir... Eh impor barang dr china pula..'",1,0,1,0,0,0,0,0,1,1,0,0
USER selamat datang setan',1,1,1,0,0,0,0,0,1,1,0,0
USER yeuh mentalita sunda sib...g club g pendukung kunyuk kabeh...\xf0\x9f\x98\x82\xf0\x9f\x98\x82\xf0\x9f\x98\x82 URL,1,1,0,1,0,0,0,0,1,0,1,0
USER Mainnya di jamban \xf0\x9f\x98\x82',0,0,0,0,0,0,0,0,0,0,0,0
"USER Gak pernah berubah emang Biu. \n\nBisa jadi orang itu bukan bermaksud munafik sama perasaannya tapi, siapa tau itu tameng kebahagiaan dia?\n\nMikirin kebahagian mah nggak ada abisnya, mending tidur.'",0,0,0,0,0,0,0,0,0,0,0,0
"Sudah jangan terlalu banyak membingkai bangkai, cukup menjadikannya pelajaran saja, agar hidup kita semakin baik pada masa yang akan datang.'",0,0,0,0,0,0,0,0,0,0,0,0
USER Habis minum kencing onta',0,1,0,0,0,0,0,0,0,0,0,0
"USER Pak USER Muhammad ngaku nabi akhir silahkan, tapi tak boleh merampas hak orang lain mengaku nabi",1,0,0,1,1,0,0,0,0,0,1,0
Dalam 25 Tahun Utang Jokowi Setara 5 Tahun SBY: Rakyat Diperas untuk Membayar Utang ! URL,1,0,1,0,0,0,0,0,1,1,0,0
"USER Bukan cuma foto selfie, tapi juga foto badan, dll. Terutama foto yang bajunya terbuka. Beware, orang sinting makin banyak. Setidaknya menjaga itu lebih baik.'",0,1,0,0,0,0,0,0,0,0,0,0
"USER USER Contoh orang baek itu bpk jokowi, programnya: mobil esemka menjadi mobnas, membangun tidak mengandalkan hutang...dll.",0,0,0,0,0,0,0,0,0,0,0,0
USER USER USER USER USER USER USER USER USER USER USER USER USER USER USER USER USER USER RBA dpt latihan kubus,0,0,0,0,0,0,0,0,0,0,0,0
"Kata cewek ""Semua Lelaki itu\nbrengsek"" Nah guys kalo lo brengsek\nberbanggalah, Brarti lo laki.'",0,1,0,0,0,0,0,0,0,0,0,0
"USER USER USER USER USER Setuju dibatalin, lah wong ustad ngomongnya ""jancuk"", ""matamu""...kasar dan kotor, apa yg mau diambil ilmunya? Lanjut mas Permadi Arya..\xf0\x9f\x91\x8d\xf0\x9f\x91\x8d'",0,1,0,0,0,0,0,0,0,0,0,0
Gw curiga kalo Ahok kalah pemilihan kepala daerah itu konspirasi biar penduduk Jakarta pada pindah ke Meikarta daripada punya gubernur yg gak kompeten.,1,0,1,0,0,0,0,0,1,1,0,0
deklarasi pilkada 2018 aman dan anti hoax paguyuban budidaya lele jabon,0,0,0,0,0,0,0,0,0,0,0,0
USER 3. Hal itu juga telah diakui oleh WHO bahwa orientasi seksual seperti homoseksual atau biseksual bukanlah gangguan. Baru2 ini bahkan Transgender sendiri juga dicoret dari daftar gangguan jiwa. Bisa search sendiri data validnya dari WHO.',0,0,0,0,0,0,0,0,0,0,0,0
USER USER USER USER Bom yang real mudah terdeteksi bom yang terkubur suatu saat lebih dahsyat ledakannya itulah di sebut Revolusi Jiwa',0,0,0,0,0,0,0,0,0,0,0,0
Alhamdulillah sebagai pendukung yang kalah sy tdk pernah berkata sontoloyo kepada klub idola org lain. Krn sy tau kata2 itu muncul akibat pelampiasan amarah. Syg skl oknum tak terlihat melakukan itu saat puasa \xf0\x9f\x98\xa2',0,0,0,0,0,0,0,0,0,0,0,0
USER Karna lu jbjbnya udah siang coba tdi pagi pasti masih pagi yakan? Tolong jangan goblok tang wkwk',0,1,0,0,0,0,0,0,0,0,0,0
USER Tolol luh.',1,1,1,0,0,0,0,0,1,1,0,0
"USER USER USER Matamu picek, itu kinerja lanjutan dari USER alias Ahok.'",1,1,1,0,0,0,1,0,0,1,0,0
RT USER: Contoh babi 1:\n\nDah tahu dah nak merah pegi jalan lagi. Kalau tak sangkut takpe. Ni sangkut kat tengah jalan. Pastu orang lain\xe2\x80\xa6',0,1,0,0,0,0,0,0,0,0,0,0
"Hadeh. Gajetot.\n\nGak jelas, ngentot.'",1,1,1,0,0,0,0,1,0,1,0,0
"ð???ð??¥Warga Baduy setelah selesai memperingati tradisi Seba di Pendopo Pemkab Lebak akan dilanjutkan kembali bertemu dengan Gubernur Banten Wahidin Halim hari ini, Sabtu (21/4) #SebaBaduy2018",0,0,0,0,0,0,0,0,0,0,0,0
"USER USER USER USER USER USER USER USER USER, siapapun U apalagi yg mentil2 ntu sm2 goblok tolol bin bahlul,, onta kampret\xf0\x9f\x98\x80'",1,1,1,0,0,0,0,0,1,1,0,0
Menjelang Pilkada Anggota Polsek Tegalrejo Polres Magelang sambang/DDS pada Tokoh Agama sertaâ?¦,0,0,0,0,0,0,0,0,0,0,0,0
Ahok: Masih Perlu Diskusi untuk Terapkan Sistem Ganjil-Genap,0,0,0,0,0,0,0,0,0,0,0,0
Mangsa utama dari burung Elang Harpy adalah monyet.',0,0,0,0,0,0,0,0,0,0,0,0
BUBARKAN ILUNI UI,1,0,0,1,0,0,0,0,1,0,0,1
USER Gua buta bahasa asing artinya sangat lelah itu apaan min?',0,0,0,0,0,0,0,0,0,0,0,0
\xf0\x9f\x91\xa9mamah \n\xf0\x9f\x91\xb5nenek\n\n Ceritanya mamah abis beli kerudung diliatin ke nenek \n\n\xf0\x9f\x91\xa9(ngelebarin kerudung)tuh gede ya enak dipakenya\n\xf0\x9f\x91\xb5iya taplak meja \n\nSeketika aku ngakak sengakak ngakaknya:( kenap,0,0,0,0,0,0,0,0,0,0,0,0
USER USER USER Susu monyet liar yee',0,0,0,0,0,0,0,0,0,0,0,0
"Emang kalo mau PACARAN harus punya PACAR dulu ya? Terus, kalo kita mau SARAPAN harus jadi SARAP dulu, gitu? #galau'",0,1,0,0,0,0,0,0,0,0,0,0
USER USER Memang sengaja... Melihat hasil pilkada dki yg memuaskan bagi mereka ..,0,0,0,0,0,0,0,0,0,0,0,0
"Megawati : Ingat...!!!; Anda Itu Petugas Partai,; .; Santai aja Bu. ga usah marah marah gitu..; 2019 bisa diganti koq Bu; Tenang aja...; #2019GantiPresiden",1,0,1,0,0,0,0,0,1,1,0,0
Apa yang aku dapat sepanjang hari ini. Penguasaan bahasa melayu dalam kalangan bangsa cina amat kurang. Ada yang mampu menghafal tapi tak faham apa yang dihafal.',0,0,0,0,0,0,0,0,0,0,0,0
"cinta itu buta, buta itu gelap, gelap itu hitam, hitam itu monyet, monyet itu yang baca tweet ini.'",0,1,0,0,0,0,0,0,0,0,0,0
USER USER Ulama yg tidak dikenal......,0,0,0,0,0,0,0,0,0,0,0,0
"RT USER: Bajingan Homo!!!\nHati2 terhadap anak2 kita terutama di kamar mandi laki2, jgn biarkan sendiri! URL",1,1,1,0,0,0,0,1,0,1,0,0
USER Apa USER ga mikir ya semakinhari kesalahan Rezim semakin di tampakan ?\n\nPiye iki...',0,0,0,0,0,0,0,0,0,0,0,0
USER LOL same kak same! Aku sempet pasang posternya karena disitu Kristen Stewart cantik banget hahaha',0,0,0,0,0,0,0,0,0,0,0,0
"-- kapan. \n\n""Kemana aku harus pergi?"" \n\nSuara terdengar setengah berbisik hingga hanya dirinya sendiri yang mungkin dapat mendengarnya. Kopor yang dia tarik seolah menjadi saksi bisu dari ketidakberdayaannya saat ini. Tidak ada arah dan tujuan; hanya",0,0,0,0,0,0,0,0,0,0,0,0
35.Umat Islam harus selalu memiliki kriteria sendiri terhadap pilihan pemimpinnya. pemimpindarimasjid jangan pilih pemimpin non muslim,1,0,0,1,1,0,0,0,0,0,1,0
"Bagian dari melestarikan dungu & biadab Islam, melestarikan dukungan terhadap teroris Islam",1,1,0,1,1,0,0,0,0,0,1,0
Seorg pemuda diamankan Tim Densus 88 karna terbukti selalu mengirim bom sms ke gebetannya',0,0,0,0,0,0,0,0,0,0,0,0
"memang msh noob, sedih))'",0,0,0,0,0,0,0,0,0,0,0,0
"itu pas gue baru aja ditampol si edi eh tyo, jd bibir gue menyon. barbar emang tuh si kunyuk\n\n- chandra URL",0,1,0,0,0,0,0,0,0,0,0,0
"USER Cinta itu buta cha tapi walaupun begitu amitamit ya jgn sampe, ga ada enaknya :('",0,0,0,0,0,0,0,0,0,0,0,0
USER GILA MENTANG MENTANG DAH BUKAN ANAK SMA',0,1,0,0,0,0,0,0,0,0,0,0
"USER Browh. Anda punya wewenang di DPR utk bentuk pansus ato apalah.. Ambil action donk, cocot aja di twitter..'",1,1,1,0,0,0,0,0,1,1,0,0
"USER USER Andai tak ada Pak Harto, Indonesia sudah jadi negara komunis. Satu dari dua ideologi yg saya benci.'",0,0,0,0,0,0,0,0,0,0,0,0
"8. Presiden USER: Saat ini berdasarkan laporan yang saya terima terdapat 945 ribu ASN, 275 ribu TNI, dan 360 ribu anggota Polri yang belum memiliki rumah yang bersifat permanen #JokowiPercepatPenyediaanPerumahan",0,0,0,0,0,0,0,0,0,0,0,0
"Seandainya Prabowo Presiden Konflik Rohingya Jadi Apa? Jadi ga jelas, semuanya ditipu oleh prabowo",1,0,1,0,0,0,0,0,1,1,0,0
USER Dia idup di sini pake duit transferan full dari Indonesia apa ya/semacamnya? Ga yakin dia idup macam TKI kek aku :)))))',1,0,1,0,0,0,0,0,1,1,0,0
"Dia digendong namun tetap tdk sombong. Dipanggul namun tetap tidak merasa unggul. Dan dihormati namun tetap rendah hati. Dialah USER; ; Kalian tahu siapa mereka yg memanggul Presiden kita? Mereka adlh pasukan elit TNI penjaga kedaulatan NKRI, bukan juru",0,0,0,0,0,0,0,0,0,0,0,0
USER Bisa...tapi harus siap dikatain kafir komunis antek asing dsb...',0,0,0,0,0,0,0,0,0,0,0,0
"USER Kita tunggu saja!\n\nAda satu yg beda, kalau KOMUNIS: Komunis Gaya Baru..\n\n^_^'",0,0,0,0,0,0,0,0,0,0,0,0
Trimakasih ya allah engkau tlah tunjukan kebesaranmu... Engkau tlah membukakan mata hatiku yg buta krn cinta...trimakasih tuhan engkau masih menolongku..',0,0,0,0,0,0,0,0,0,0,0,0
"JOKOWI PILIHAN PASTI 2019; ; Capres itu tidak musti 'BONGKAR PASANG', isi lobang congklak, karena Presiden tidak boleh 'COBA-COBA'; ; Supaya pikiran LURUS &amp; NEGERI TERURUS..; Pilihan pada USER; ; #2019TetapJokowi; #2019T3tapJokowi; #JokowiSemakinKu",0,0,0,0,0,0,0,0,0,0,0,0
"Pernah nanya ke orang kristen apa enaknya ibadah minggu pagi, kan enakan tidur. Lalu bales dijawab, lah gue malah bingung sama kalian yang islam solat 5x sehari gak capek apa. Lah iya bener juga'",0,0,0,0,0,0,0,0,0,0,0,0
"Belajar Agama or Islam? Jika belajar Islam, percaya Adam Nabi jadi dungu, nyembah Allah SWT benci kafir jadi biadab?",1,1,0,1,1,0,0,0,0,0,1,0
Punya mata sipit gaenak\n\nsusah pake eyeliner',0,0,0,0,0,0,0,0,0,0,0,0
jaringan indosat memang ampas sekali \n3:) fuck you indosat',1,1,0,1,0,0,0,0,1,0,1,0
USER kucing i kalau terbuka pintu sikit terus panjat pagar \xf0\x9f\x99\x84\xf0\x9f\x99\x84 belajar dr monyet ke apa',0,0,0,0,0,0,0,0,0,0,0,0
"USER Iya monyet2 juga sedih, kandang orang utan yg ada air disekelilingnya jg parah sih, kotoe bgt. Orang utan nya gakliatan ntah kmana kaya film RISE THE PLANET OF THE APES :(\n\nIya yg danau dkt kandang buaya pun kaya rawa2 gt. Kalo dulu kan ada w",0,0,0,0,0,0,0,0,0,0,0,0
USER KPK di berhentikan? Yang paling bagus itu DPR yang di bubarkan bosUSER,1,0,0,1,0,0,0,0,1,0,1,0
USER USER Tapi aku tetap berdiri kukuh dengan tweet pertama aku. Menggunakan agama untuk mainan politik.,0,0,0,0,0,0,0,0,0,0,0,0
USER USER USER USER Nah loh Zul \xf0\x9f\x98\x82\xf0\x9f\x98\x81 mosok selembar softex dibilang lebih berharga dari congor lu Zul \xf0\x9f\x98\x9c USER',0,1,0,0,0,0,0,0,0,0,0,0
USER USER USER USER USER USER USER USER USER USER USER USER USER USER USER USER USER USER USER USER USER USER USER,1,1,1,0,0,0,0,0,1,1,0,0
RT USER Mending loe beritain mentri joko atau jokowi nya yg mundur krn gagal hadirkan pemerintah yg berkualitas minimal ber IQ,1,0,1,0,0,0,0,0,1,1,0,0
Bertemu dg tokoh agama non muslim juga pak de....supaya seimbang....,0,0,0,0,0,0,0,0,0,0,0,0
USER USER USER Yang pasti Bukan keluarga pki di Negara Pancasila yang Berbhinneka Tunggal ika ini keluarga nya',0,0,0,0,0,0,0,0,0,0,0,0
"Seriuus neh berita ??? Polisi mau ikutan politik... Kok braninya ama tukang becak... Emang dia doang yg pakek... Dah mulai ketakutan yaa.. ""power syndrome melanda istana"" vs tukang becak. USER USER USER USER USER",1,0,0,1,0,0,0,0,1,0,1,0
"MenAgama jangan hanya OMDO, harus mengumumkan ayat rampasan halal & Allah SWT janjikan rampasan, SALAH & hrs dibuang",1,0,0,1,1,0,0,0,0,0,1,0
"Tidak memulai memberikan salam kepada Ahlu Kitab, sebab Rasulullah Shallallaahu \xe2\x80\x98alaihi wa sallam bersabda :\xe2\x80\x9d Janganlah kalian terlebih dahulu memberi salam kepada orang-orang Yahudi dan Nasrani\xe2\x80\xa6.. \xe2\x80\x9d (HR. Musli",0,0,0,0,0,0,0,0,0,0,0,0
USER USER Penistaan bencong',0,0,0,0,0,0,0,0,0,0,0,0
"USER USER USER USER USER USER USER Ohhhhh, kader moncong putih kan? Ciri khas cebong, pasti serang ke Islamnya.., coba yg ngelakui tapir psti MINGKEM'",1,1,0,1,0,0,0,0,1,0,1,0
Melepaskan orang yg kamu cintai jauh lebih sulit dibanding menerima cinta yg baru yg asing bagi hatimu.ipadnews',0,0,0,0,0,0,0,0,0,0,0,0
"USER Ada gak selama ini kasus mobil yg sedang parkir, kondisi mesin mati, lalu bisa terbakar. Ini bisa bahaya jika mobil diparkir dlm garasi rumah, bisa penyebab kebakaran. Tapi kasus itu tdk pernah terjadi kecuali kasus mobil neno warisman. Past",0,0,0,0,0,0,0,0,0,0,0,0
USER Ikutilah seruan ulama yang hanif ð???,0,0,0,0,0,0,0,0,0,0,0,0
Nurul Arifin tak Goyah Hadapi Survei USER #BandungGeulis #BandungHarmonis #bandungvotenuruli #calonwalikotabandung #calonwalikotabandung2018,0,0,0,0,0,0,0,0,0,0,0,0
typo lagi kampang :))))))',0,1,0,0,0,0,0,0,0,0,0,0
"USER Mungkin masih banyak masyarakat tionghoa yg lebih pancasialis dr pada wong jowo cm nggak terekpos aja, contoh nyata pak kwik ekonom dan ustadz felix siauw \xf0\x9f\x98\x85'",1,0,0,1,0,1,0,0,0,0,1,0
Keren...... Kapan umat Budha kita usir dari Indonesia?,1,0,0,1,1,0,0,0,0,0,1,0
"Ha .. ha .. Banyak baca biar pintar ... JEPANG, AMERIKA, CHINA... Utang sama siapa ... Anda tau enggak ..?",0,0,0,0,0,0,0,0,0,0,0,0
