Tweet,HS,Abusive,HS_Individual,HS_Group,HS_Religion,HS_Race,HS_Physical,HS_Gender,HS_Other,HS_Weak,HS_Moderate,HS_Strong
Dimana akan ditemui Alim Ulama yg memiliki Silsilah Ilmu Pengetahuan yg tidak terputus s/d Rasulullah SAW? Cek Alywafa dot com USER,0,0,0,0,0,0,0,0,0,0,0,0
"USER USER USER USER USER USER Jgn besar-besar kan si idiot itu, nanti dia jumawa, toh dia menang kemaren itu kita sama-sama tahu #2019GantiPresiden'",1,1,1,0,0,0,1,0,0,1,0,0
Donatur 212....adalah bajingan URL,1,1,0,1,0,0,0,0,1,0,1,0
kamu mahasiswa jurusan? â?? D3 ekonomi keuangan,0,0,0,0,0,0,0,0,0,0,0,0
USER IYA KNTL MANIS :)',0,1,0,0,0,0,0,0,0,0,0,0
"RT USER: USER Iblis berpesta dalam amarah di dada manusia..Islam mengajarkan berdakwah dengan santun, lemah lembut dan penu\xe2\x80\xa6'",0,0,0,0,0,0,0,0,0,0,0,0
USER Biar cepat mati cucumu sontoloyo',1,1,1,0,0,0,0,0,1,1,0,0
USER USER USER mungkin dia bukan islam. husnuzon hhhmmm,0,0,0,0,0,0,0,0,0,0,0,0
"RT USER: Kelakuan homok jaman now, ngentot aja sambil live di Blued #gayvid #gvid #lokalhangat URL",0,1,0,0,0,0,0,0,0,0,0,0
Wah edan itu fotosyut',0,1,0,0,0,0,0,0,0,0,0,0
BRENGSEK BOYFRIEND SEKALI AKU GA KUAT',1,1,1,0,0,0,0,0,1,1,0,0
Disaat aktif pun kang antoncharliyan selalu bersinergi dengan para ulama .... hasanahkanggojabarâ?¦,0,0,0,0,0,0,0,0,0,0,0,0
Usir cina...tidak menghargai..,1,0,0,1,0,1,0,0,0,0,0,1
USER Gaya pengumpylan masa PKI',0,0,0,0,0,0,0,0,0,0,0,0
Kamar guru terus mushola.\n\nNah kalau yang kristen pada berdoa di aula atas. (Yang kristen ga terlalu banyak)\n\nAku kan punya temen yang kristen sebut aja si A. Si A ini di mintain tolong sama guru buat ambilin casan laptopnya.\n\nDan tempatnya itu di,0,0,0,0,0,0,0,0,0,0,0,0
"Uname absurd bahkan first impression gak akan bikin enak imaginenya, dan gak ganteng typing pas dicoba eue di dm enak banget. Berharap di dm lagi ternyata enggak sama sekali:"")'",0,0,0,0,0,0,0,0,0,0,0,0
USER Gapapa sipit juga cantik aku mah \xf0\x9f\x98\x86',0,0,0,0,0,0,0,0,0,0,0,0
USER Gua ge akan marah. Cuma auto blacklist dari kehidupan gue.\n\nSampah apa gunanya kalo ga didaur ulang?',0,0,0,0,0,0,0,0,0,0,0,0
"USER Udah culun nih serigala margonda, payah!'",1,1,1,0,0,0,0,0,1,1,0,0
"Ongkos cetak uang mungkin murah, tapi mencetak uang itu perlu cadangan emas yang cukup. Makanya enggak bisa sembarangan. Sedih nih guru Ekonomi SMP-SMA kalau tahu parpol oposisi ngetweet begitu. ð?¤£ð?¤£ð?¤£ð?¤£",0,0,0,0,0,0,0,0,0,0,0,0
RT USER: Memek gatel pengen di kentot pake kontol keker',0,1,0,0,0,0,0,0,0,0,0,0
USER USER USER USER USER USER USER USER USER Gak hidup cebong klo gak produksi dan makan hoaks.',1,1,0,1,0,0,0,0,1,0,1,0
USER USER Ganti presiden semua tka cina pulangin ke dataran cina pakai getek',1,0,0,1,0,1,0,0,0,0,0,1
USER USER USER Yang dongo bego itu loe',1,1,1,0,0,0,0,0,1,1,0,0
Cepat tidak selalu lebih hebat. Pun lambat tidak membuatnya jadi cacat. #StopComparingMySelfToOther',0,0,0,0,0,0,0,0,0,0,0,0
UMAT HINDU SAMPAIKAN SELAMAT ULANG TAHUN KEPADA PRESIDENÂ SOEHARTO,0,0,0,0,0,0,0,0,0,0,0,0
Cinta itu buta.. Tapi ga budek.. Tau mana suara motor dan suara mobil.. Apalagi mobil sport \xe2\x94\x92(\xcb\x87_\xcb\x87)\xe2\x94\x8e #MT',0,0,0,0,0,0,0,0,0,0,0,0
(cont.) mendekati Phoebe dengan tatapan\xe2\x80\x94entah lah. Keanu tidak merasa terintimidasi. Hanya saja terlalu tidak ramah untuk orang asing yang baru bertemu. Sementara Ilya yang berada di gendongan nya pun ia hadapan kan ke depan. Tangan mungil nya,0,0,0,0,0,0,0,0,0,0,0,0
5 tahun ke depan gak bakal menghabiskan waktu buat membenci anies-sandi.,1,0,1,0,0,0,0,0,1,1,0,0
"Sebanyak 1,8 juta orang tenaga kerja asal Indonesia bermasalah di luar negeri. Terutama di 32 negara tempat mereka bekerja,dengan yang paling banyak bekerja di negeri Jiran Malaysia.\n URL USER USER'",0,0,0,0,0,0,0,0,0,0,0,0
USER USER USER jangan sampe :\xe2\x80\x9d( cukup sekali ngeliat kunti melayang :\xe2\x80\x9d(',0,0,0,0,0,0,0,0,0,0,0,0
Dukung saja Pak de... ahok Anda dukung juga kan!! RAKYAT sudah semakin faham...cerdas..mana PEMBUAL mana PEMIMPIN URL,1,0,1,0,0,0,0,0,1,1,0,0
USER USER Dia nyinyir biar di ajak gabung ama Presiden kale',1,0,1,0,0,0,0,0,1,1,0,0
"Bismillah,; superiorPRINTING;; Harga; Ecer :LGNpolos135k,Print 145k; Lusin:LGNpolos 120k,Print130k; ; Bahan : Serena ,Drifit, PE sp; Info order:; Pin. 5FD97626; Wa. 081210090063; IG . sriyonoyn; #bolanet #pilkada #Jersey4Sale; #Jersey; #GoesToFestivalTamb",0,0,0,0,0,0,0,0,0,0,0,0
kerja kelompok sambil ngentot URL #bokep #ngentot #memek #bugil #bispak',0,1,0,0,0,0,0,0,0,0,0,0
JakartaBanjir Pemimpinnya gak punya akhlak yg baik... PENISTA AGAMA.,1,0,1,0,1,0,0,0,0,1,0,0
Tetap semangat &amp; istiqomah bung USER,0,0,0,0,0,0,0,0,0,0,0,0
"USER \xe2\x80\xa2 My Idiot Brother (yaolo itu tuh pak :(\n\xe2\x80\xa2 Ayah Mengapa Aku Berbeda (Filmnya saya lupa gmn tapi bukunya sukses bikin saya menye-menye)\n\xe2\x80\xa2 Surat Kecil Untuk Tuhan (ini mah paling paling sih)\n\xe2\x80\xa2 Habibie &amp; Ainun (malu ini pak saya terharu di depan ortu mun)\n\n\xe2\x80\x94 447, danke pak!'",0,0,0,0,0,0,0,0,0,0,0,0
"USER USER USER USER Horee 2019 kita ganti presiden.\nAsiiik, tapi siapa gantinya bang? \nGoblok, tolol, kunyuk malah nanya, ya kita cari bareng2 koplok. \nOoo, kirain udah ada bang..\n\nKata rockygering inilah sekumpulan c",1,1,1,0,0,0,0,0,1,1,0,0
"""Dan perangilah mereka, supaya jangan Ada FITNAH Dan supaya Agama itu semata untuk ALLOH, jikaâ?¦",0,0,0,0,0,0,0,0,0,0,0,0
Blokir CINA? - Telegram diblokir krn jokowi tuduh digunakan teroris. Sabu asal Cina. Apa Cina kita usir saja sesuai dgn cara berpikir rezim?,1,0,0,1,0,1,0,0,0,0,1,0
"USER Saya tiba2 langsung stroke, wekekkeke ini mah cuma orang picek aja yg gak tau'",1,1,1,0,0,0,1,0,0,1,0,0
"Indonesian Heritage Society... What a shame! Yang membudidayakan malah orang asing, sampai managernyapun Asing... Tapi gak ada orang2 Indonesia yg perduli USER USER'",0,0,0,0,0,0,0,0,0,0,0,0
Pendrive 16GB RM45. Betul harga yahudi dia bagi. Memang pangkah terus kedai tu.',1,0,1,0,1,0,0,0,0,1,0,0
USER bentar bentar kunyuk mirip siapa yak *mikir keras*',1,1,1,0,0,0,0,0,1,1,0,0
"Pngn ngatain akun2 yg bilang ""nyari yg seumuran, no om2"" itu, ""enakan sama om2, bego!""'",0,1,0,0,0,0,0,0,0,0,0,0
"Perbedaan banget sama Adi.\n\nKalo Adi mah,\n\n""TUH KAK, LIAT! GUE BILANG JUGA APA DIA BRENGSEK!""\n\nYha. URL",1,1,1,0,0,0,0,0,1,1,0,0
"USER Ente klo berani jgn Gk ada fotonya,jgn jd pecundang dan jadi antek2 kompeni? Nonton tuh bokep mulu ditwitter lo,pantes ancur indonesia.dasar otak mesum USER USER USER USER USER USER USER",1,1,1,0,0,0,0,1,0,1,0,0
"USER Dibanding rezim sbelum nya,sebuah lompatan yg sangat sangat besar\n\nBneran banyak yg harus di perbaiki\nYg utama adalah masalah hukum'",0,0,0,0,0,0,0,0,0,0,0,0
meski banyak tudingan dugaan korupsi tapi SBY tdk pernah dorong kejaksaan usut. Apalagi himbau KPK usut dugaan korupsi Jkwi disolo raya,1,0,1,0,0,0,0,0,1,1,0,0
RT USER: #ngemut #kontol segede itu ... terus #crot di mulut .... beuh ... kenikmatan duniawi ya gays ... #gay #coli #bahan coli\xe2\x80\xa6',0,1,0,0,0,0,0,0,0,0,0,0
"USER aktris dehh :\'( tar kamu jd transgender kalo aktor :""('",0,0,0,0,0,0,0,0,0,0,0,0
Bodo amat bego.',1,1,1,0,0,0,0,0,1,1,0,0
"USER Presiden USER, saya dukuuuuuuung #RakyatB3rsamaJKW",0,0,0,0,0,0,0,0,0,0,0,0
"So far tantangan nya sih ya musti sehat ya bolak balik sana sini ngurus dokumen. Karena semuanya harus terprepare sangat matang! Dan jadi pengalaman juga gimana serunya TKI kek gue susah payah antri, macet, dll.'",0,0,0,0,0,0,0,0,0,0,0,0
"USER Yaa minimal ga ada kata ""kntl"" dari wor mereka'",0,1,0,0,0,0,0,0,0,0,0,0
"PRESIDEN DIHINA. Kapolri, Menkumham, Mendikbud, Menhan, Abu Janda, Anshor, Banser. Semua terdiam. Ajaib.'",1,0,0,1,0,0,0,0,1,0,1,0
"USER Salam ustaz...nak tanya...apakah hukum Kalau dalam bab jual beli seharian kita... Pembeli dan penjual tak sebut akad seperti ""saya jual"" dan ""saya beli""....",0,0,0,0,0,0,0,0,0,0,0,0
USER USER Ancem2an kaya banci aja jancok',1,1,1,0,0,0,0,1,0,1,0,0
"RT USER: Aku tuh gimana ya. Merasa lebih berdosa aja kalo misal okelah menikah muda, tapi anak cucuku kelak susah makan, susah idup,\xe2\x80\xa6'",0,0,0,0,0,0,0,0,0,0,0,0
"Regrann from obrolanpolitik - JAKARTA,",0,0,0,0,0,0,0,0,0,0,0,0
Orang punya saksi anjing dikasus babi.. Tolol URL,1,1,1,0,0,0,0,0,1,1,0,0
"Serbuan TKA China, lalu Polisi bersama, lalu penyelundupan senpi... Hmmm \xf0\x9f\x98\x96 ada apa yaaa?... URL",1,0,0,1,0,1,0,0,0,0,1,0
"Kelebihan orang siapa tau. Macam Tun Chedet lah, sampai u turn pun dia tau ð??? nak jadi PM balik katanya",0,0,0,0,0,0,0,0,0,0,0,0
"Ehh TAIK, Bangsat lo, Omongan elo kayak IwAn bopeng, yg MO potong leher TNI, Bangsat lo IwAn bopeng, baek2in TNI. TAIK LO,",1,1,1,0,0,0,0,0,1,1,0,0
#ThomasUberCup2018 ada si rexy eek',1,1,1,0,0,0,0,0,1,1,0,0
USER USER Tenggelamkan....itu bocah kepalanya korengan yg maha sombong selangit. Nangislaj kau keparat dlm wkt secepatnya',1,1,1,0,0,0,1,0,0,1,0,0
Potret Rezim Jokowi anti pd umat islam bkn sj di indonesia yg dipimpin tpi bahkan dinegara lain sptr Myanmar skrg,1,0,1,0,0,0,0,0,1,1,0,0
USER Wkwkwkwk mampus luh',1,1,1,0,0,0,0,0,1,1,0,0
Mencairkan suasana dan membangun komunikasi bisa berbagai macam cara. Bisa dgn ngobrol &amp; tertawa bareng atau bisa juga dgn ngevlog. :-),0,0,0,0,0,0,0,0,0,0,0,0
"eh tp ya ngomongin pacaran beda agama. Temen gue ortunya beda agama, tapi tetep sama keyakinannya masing2..... ibunya islam ayahnya kristen. Berarti gapapa dong?'",0,0,0,0,0,0,0,0,0,0,0,0
"USER Aadren mengerti apa yang dirasakan puan itu. Pasti sangat menyakitkan. Apalagi melihat kekasihnya bersama orang lain. \n\n""Kau harus tegar. Kau tak boleh menangisi seorang bajingan yang tak sepantasnya kau tangisi.""'",0,1,0,0,0,0,0,0,0,0,0,0
USER AUTIS GARA2 GIGI GINGSUL PWJ \xf0\x9f\x98\x82\xf0\x9f\x98\x82\xf0\x9f\x98\x82\xf0\x9f\x98\x82',0,1,0,0,0,0,0,0,0,0,0,0
Walah....jadi ini toh maksud anies sandi dgn DP 0%. Smua pendukungnya bisa nginep gratis di penjara. okeoce saracen,1,0,1,0,0,0,0,0,1,1,0,0
"USER Waduh, ga ah tar dikira panasbung \xf0\x9f\x98\x82'",0,0,0,0,0,0,0,0,0,0,0,0
"USER Beda negara beda definisi - definisi USER : pemulung, TKI, TKW, pengemis nggak miskin krn makan 3x sehari dan income &gt;Rp 600,000/bulan dll USER USER USER USER USER USER USER USER",0,0,0,0,0,0,0,0,0,0,0,0
RT USER: Sebar Hoax Pembangunan Era Jokowi,1,0,1,0,0,0,0,0,1,1,0,0
"Dan ajeng pasti paham si Babi Ahok klo bicara santun, BANGSAT, TAIK, ANJING, SETAN LO, dngn intonasi yg familiar tuntuna",1,1,1,0,0,0,0,0,1,1,0,0
Astaghfirullah...sejak kapan Al-Qur'an berisi 33 Juz ? ??; .; ; .; .; #2019GantiPresiden ; #GantiPresiden2019,1,0,1,0,0,0,0,0,1,1,0,0
USER semalem nonton Kafir (2002) mbah USER keren jadi wali \xf0\x9f\x91\xb3',0,0,0,0,0,0,0,0,0,0,0,0
USER Apalah kau ini bener2 bangsat bodoh tolol bajingan tengik',1,1,1,0,0,0,0,0,1,1,0,0
Hak Asasi Manusia tidak hanya tentang hak sosial politik. tetapi juga hak ekonomi sosial budaya. -Pihri Buhaerah,0,0,0,0,0,0,0,0,0,0,0,0
USER USER Tunjukkan di dunia ini ada pernah Muslim membantai umat lain ?????? TUNJUKKAN bung !!!!!,1,0,1,0,0,0,0,0,1,1,0,0
USER USER DPR DPRD jancok asu aanjing babi kontol jembut bajingan bangsat tempek gendeng taeeekkk banci',1,1,0,1,0,0,0,1,0,0,1,0
"USER lost respect untuk kesekian kalinya buat agency yg lo banggain, buat artis yang lo banggain. \nkelakuan tai kucing di kasih nyawa sih kea gini. \n\nlo di tampol duit sama lee sooman mau? di tampol lamborgini sama GD mau? di tampol sama material",1,1,0,1,0,0,0,0,1,0,1,0
Kalo ga merasa selingkuh kenapa harus risih..?\nSepandai kau simpan bangkai pada akhirnya akan kecium juga.\nWaktulah yg akan membuktikan.',0,0,0,0,0,0,0,0,0,0,0,0
USER Ai uu md3 nanahaon tateh nya?',0,0,0,0,0,0,0,0,0,0,0,0
"\xe2\x80\x9cHarini pergi kerja tak ?\xe2\x80\x9d\n\n\xe2\x80\x9cTak, kerja cancel.\xe2\x80\x9d\n\nAsing banget sih bunyi nya, \n\nKelas cancel - kerja cancel \xf0\x9f\x98\x85'",0,0,0,0,0,0,0,0,0,0,0,0
USER USER Ohh rujukannya orang merah juga.. yang dulu temamenan bareng sama PKI.. gak kapok\xc2\xb2 begonya lu Bong..',1,1,1,0,0,0,0,0,1,1,0,0
USER Hanya orang bodoh yg pilih sontoloyo',1,1,0,1,0,0,0,0,1,0,1,0
"Jgn ada yg percaya dgn akun ini\n\n\xe2\x9e\xa1 USER \n\xe2\x9e\xa1 WA 081381413774\n\nAwal nya dia ga percaya sy buat\nCAMSEX, trus sy buktikan Vc beberapa detik, pas suruh Tf alesan nya neko2\n\n\xe2\xac\x87Ni muka nya kaya monyet \xe2\xac\x87 URL",1,1,1,0,0,0,1,0,0,1,0,0
USER Cuman tokoh Gusdur presiden yg mrngakui warga cina jadi WNI dan ahir nya indonesia sampek bener2 mw d kuasai oleh cina.....,1,0,1,0,0,1,0,0,0,1,0,0
USER LAH ANJIR KENAPAAA MENCRET MKSDNYA?:(',0,1,0,0,0,0,0,0,0,0,0,0
"USER Terima kasih atas informasinya...agar saya lebih jelas, mohon mas Jean Ivan berkenan kirimkan akun banci dimaksud ke DM saya.. maklum, saya gadget-er gagap... terima kasih...'",0,1,0,0,0,0,0,0,0,0,0,0
"USER USER USER USER Mental itu selalu minta mobil rantis, minta dikawal polisi,. \n\nSayang banget tuh bis ga dilempar molotov ye, kayak di jl gatsu.\n\nmental itu bikin nazar nikah sama monyet ? Terus ? \n\nMental itu ngerusak stadion gbk? Aset negara, \n\nTerus ada yg dapet proyekan dari kementrian, lol'",0,1,0,0,0,0,0,0,0,0,0,0
USER USER buseeet nuzuuuk bangeet ke MALING DUIT si ZUMI jhiahaha alumi 212 pikiran cuma gimana jadi maling bisa kasih makan onta NASBUNG kalau lagi demoooo kwkwkwkw',1,1,1,0,0,0,0,0,1,1,0,0
19. Koruptor pribumi yg disuruh kabur sebelum ditangkap contohnya Nazarudin. Info penangkapan dibocorkan KPK kepada Nazar dgn imbalan USD 1 juta\n\nLalu pejabat polda mengantar dan kawal Nazar sampai naik pesawat. Akhir cerita Sampai di Kolombia \n\nItulah KPK kita \n\nBejat',1,1,0,1,0,0,0,0,1,0,1,0
RT USER ..hehh wo.. jika rakyat masih susah nape si ZON malah minta para temen DPR baru ? .. situ masih waras kan wo ? ga makan micin kan ?,1,0,1,0,0,0,0,0,1,1,0,0
USER USER Pantas indonesia mundur dalam segala bentuk,1,0,1,0,0,0,0,0,1,1,0,0
USER USER USER USER Apanya yang kebuka kemunaqikannya,1,0,1,0,0,0,0,0,1,1,0,0
"RT USER: Ya, saya bajingan\nTERIMA KASIH'",0,1,0,0,0,0,0,0,0,0,0,0
"USER Namanya anak buah iblis, \nmuslim taat dimusuhi muslim bermaksiyat dipuji-puji.\nPembela negeri dia benci, penjilat asing dia hormati.'",0,1,0,0,0,0,0,0,0,0,0,0
"USER USER USER bukti apa? pertumbuhan ekonomi stagan di 5% jaman SBY 6%, sdah hampir 5 tahun proyek joko hasil ngutang ke cina baru selesai 35 proyek dari 250 proyek, proyek infrastruktur pemda yang otonomi daerah di klaim prestasi",0,0,0,0,0,0,0,0,0,0,0,0
"USER Dah kau tanya aku jawab lah hahahaha dah tu kau ingat aku bisu? Tau orang bisu romen macam mana??!! Tapi aku rasa banyak guna tangan lah, nak apa tunjuk je macam beli kuih raya \xf0\x9f\x98\x82\xf0\x9f\xa4\x94'",0,0,0,0,0,0,0,0,0,0,0,0
"#MataNajwaDebatJakarta Pak Anies suka nyinyir, suka memutar balik kan fakta, ga punya program yg jelas bisanya jelekkan kinerja pak Basuki",1,1,1,0,0,0,0,0,1,1,0,0
[Situs Genosida] Jejak Senyap Kekerasan Politik dan Budaya di Banyuwangi,0,0,0,0,0,0,0,0,0,0,0,0
RT USER: USER USER adian gaya lu kaya beruk. Gini klo supir tembak metromini masuk dpr.\nKampungan lu.',1,1,1,0,0,0,0,0,1,1,0,0
"Spoiler running man 401, haha yg menang wkwk kacrut'",0,1,0,0,0,0,0,0,0,0,0,0
"nemu jawaban dari seorang ustadz kenapa babi diharamkan\nlah netijen yang udah pinter malah ngata-ngatain bodoh, hidup ga bermanfaat, ga pernah ngaji dll. \xf0\x9f\x98\x91\xf0\x9f\x98\x91\xf0\x9f\x98\x91'",0,0,0,0,0,0,0,0,0,0,0,0
"Aku lagi nyoba banget pakai bahasa ga nyampur2. Susah ternyata. Semakin aku tau banyak kosakata dari berbagai bahasa, aku kadang jadi bingung ""ini tuh apa"" ""duh lupa aku pokoknya inilah (pakai bahasa asing)"".\n\nSebut saja kemampuanku mengolah mereka ga",0,0,0,0,0,0,0,0,0,0,0,0
RT USER: Maaf tak menyelesaikan masalah. Sudah berapa banyak peternak dan pedagang dirugikan akibat ulah manusia ini? Dan sudah be\xe2\x80\xa6',0,0,0,0,0,0,0,0,0,0,0,0
Awas Provokasi...Jokowi disebut Antek Cina dan Anti Islam,1,0,1,0,0,1,0,0,0,1,0,0
"USER Rupiah anjlok krn ulah kalian2 selama hidup tdk bisa menerima kebaikan,selalu buat issu negatif , contoh issu PKI pada saat tax amnesti,wslm'",0,0,0,0,0,0,0,0,0,0,0,0
KPK Periksa Gubernur Sumut dan Cawagub Ijeck Shah,0,0,0,0,0,0,0,0,0,0,0,0
"Akom Masih di Bali, Fadli Zon Buka Masa Sidang DPR di Paripurna",0,0,0,0,0,0,0,0,0,0,0,0
"Ingin NKRI tetap eksis n terbebas dr serbuan TKA CHINA???? ; ; Mari ummat Islam Indonesia bersatu, ; GANTI PRESIDEN DI 2019. ; ; #GantiPresidenYuk ; #2019PresidenBaru",1,0,0,1,0,1,0,0,0,0,1,0
USER gampang. banget. edan',0,1,0,0,0,0,0,0,0,0,0,0
USER Gara gara yang buat orang kafeer atau yahudi atau gimana. Coba aja mereka pake hp apasih emangnya hadeh. Ntar lama lama carrefour berubah nama jadi indomaret aja',0,0,0,0,0,0,0,0,0,0,0,0
"Ayo gelorakan #2019GantiPresiden, insya Allah kesejahteraan merata. Komunis lenyap.",1,0,0,1,0,1,0,0,0,0,1,0
"USER USER USER USER Harus begitu. Kita itu harus ""Strict""deh pokoknya kl menyangkut kebijakan politik dalam negeri &amp; luar negeri yg menyangkut sama pihak asing. Kita jgn haram meniru negara komunis dlm melindungi keut",0,0,0,0,0,0,0,0,0,0,0,0
"Pak USER tolonglah. Ajak buzzer"" bapak untuk jadi lebih pinter. Bukan anggar jago menghina orang"" yg ngga suka. Pake lapor"" polisi. Duh!",1,0,1,0,0,0,0,0,1,1,0,0
Urusannya duit. Siapa dapat apa. Kalau nanti itungan bisnisnya pemerintah Indonesia untung ya kita tepuk tangan. Kalau buntung ya resiko punya rezim model gini. Tapi itu nanti. Setelah ketauan harganya. Janjinya harga wajar. Wajar buat siapa?',0,0,0,0,0,0,0,0,0,0,0,0
USER Dasar tai ijo',1,1,1,0,0,0,0,0,1,1,0,0
"#kualalumpur Ayat al-Quran yang dijadikan hujah oleh ulama untuk mengharamkan pemilihan bukan Muslim sebagai wakil rakyat, apabila diteliti sebenarnya merujuk kepada orang kafir yang memusuhi Islam dan penganutnya.",0,0,0,0,0,0,0,0,0,0,0,0
"#2019GantiPresiden Pilkada DKI 2017 kita sudah SINGKIRKAN AHOK, INSYA ALLOH #2019GantiPresiden",1,0,1,0,0,0,0,0,1,0,0,1
"...\nTapi jgn risau, server yg pki SSD, 24/7 heavy usage pun ada around more than a year before SSD tu worn out. Itu jangka masa dia lah.\n\nSo kalau laptop biasa, aku jangkakan lebih dari dua tahun korang boleh pakai. Tu pun kalau takde pape tindakan bo",0,0,0,0,0,0,0,0,0,0,0,0
"#NP USER - Falshback\n\nKamu bisa membuat masker rambutmu. Bahannya pun termasuk mudah di dapat. Kamu tinggal memilih entah itu masker alpukat, telur, santan, buah-buahan atau lidah buaya.\n\n#SERASI'",0,0,0,0,0,0,0,0,0,0,0,0
RT USER USER USER USER Zonk hanya pamer kedengkian dan kebusukan hati selalu memuakkan. Politik licik dan picik,1,0,1,0,0,0,0,0,1,1,0,0
USER Ah tae w kira pak aria beneran :(',0,1,0,0,0,0,0,0,0,0,0,0
USER yg kalem lah kntl !!!!',1,1,1,0,0,0,0,1,0,1,0,0
USER Tanya amin rais.. Dulu dia yg bikin kacau dan nyuruh reformasi. Pilkada salah satu hasilnya.,1,0,1,0,0,0,0,0,1,1,0,0
"Dalang demo kmren kelompok yg anti Jokowi, manfaatkan isu PKI, meraih simpati umat Islam tuk menyerang Pemerintahan. Lagu Lama Bang.",1,0,0,1,0,0,0,0,1,0,1,0
YANG Perlu di sadari krisis moneter itu sebenarnya krisis Ekonomi.,0,0,0,0,0,0,0,0,0,0,0,0
#catat!Terimakasih sudah menjadi orang idiot pertama dan terakhir yang membuka hatiku utk mengerti apa itu persahabatan',0,1,0,0,0,0,0,0,0,0,0,0
USER USER Era SBY ada pembangunan di papua? Ada juga hambalang tuh... pembangunan pln mangkrak brp banyak?,1,0,1,0,0,0,0,0,1,1,0,0
"DPR MPR segera ambil tindakan, PECAT DENGAN TIDAK TERHORMAT Setya Novanto, kami tidak sudi diwakili manusia hina itu!! ttd. RAKYAT INDONESIA",1,1,1,0,0,0,0,0,1,1,0,0
mau cerita. laki2 emang brengsek ya. dasar cupu',1,1,0,1,0,0,0,0,1,0,1,0
anggota dpr ri keberadaan perawat amat dibutuhkan karenanya harus dapat penghargaan setimpal,0,0,0,0,0,0,0,0,0,0,0,0
Bawang putih dapat meracuni anjing dan kucing.',0,0,0,0,0,0,0,0,0,0,0,0
Nih..Masih mo ngeles..Soal TKA Cina sdh lebih dari 1000 orang msk melalui Kendari...Pak de Hebat..Pengguran msh bnyk di Ind tp membebaskan TKA Cina klou dibiarkan terus?an #2019GantiPresiden,1,0,1,0,0,0,0,0,1,1,0,0
"USER USER USER USER Gini umat islam di bodohi pake kata fiksi. Dan alasan salman rusdhi mbuat ""the santanicverse"" berasal pembodohan seperti ini. Fiksi itu imanijer *angan2. Kalau tujuan untuk membela USER banyak nara",0,0,0,0,0,0,0,0,0,0,0,0
"Gila Sinar light lasernya merajam hidup orang untuk dibuat cacat kulit Oleh comunity dukun Nata endah sign Indonesia Raya,, merendahkan martabat hidup org dgn penuh kenistaaan hidup org2 media'",0,0,0,0,0,0,0,0,0,0,0,0
USER USER Hah ini enaknya di sate atau di saus padang titit segede gini',0,1,0,0,0,0,0,0,0,0,0,0
USER USER USER Yg ngomong gitu siapa? Yg harus loe tanya itu knp gandeng 4 bank asing? Bukannya melakukan langkah hukum utk menggugat peraturan yg mengistimewakan Freeport?',0,0,0,0,0,0,0,0,0,0,0,0
"USER Kalau kak ROSanita ayamorr dia tegur macam ni, siap la x sampai 24 jam bom sampai...'",0,0,0,0,0,0,0,0,0,0,0,0
"USER USER Itu jaman dulu mas...Jaman skrng di seklh2 Kristen aja, teori evolusi tetap diijinkan utk diajarkan tanpa meninggalkan ajaran creationis..'",0,0,0,0,0,0,0,0,0,0,0,0
RT USER: Pak jokowi semakin ketakutan akan kalah 2019 Projo kumpulan penipu kembali jadi andalan wakwawww,1,0,1,0,0,0,0,0,1,1,0,0
"USER USER USER Makkah dahulu negara merdeka. Pemimpin org2 kafir quraisyh. Juga wilayah2 lain spt tabuk, khaibar, hunain, taif...maka dilakukan penaklukan atasnya...'",0,0,0,0,0,0,0,0,0,0,0,0
USER USER Nanti umpetin setan loh. Mending mabar sudoku aja deh?',0,1,0,0,0,0,0,0,0,0,0,0
USER USER USER yang komunis itu siapa',0,0,0,0,0,0,0,0,0,0,0,0
USER Jangan jangan km korban bom bunuh diri',0,0,0,0,0,0,0,0,0,0,0,0
USER Adek orang lah sayang. Masa Mami lahirin anak tuyul.',0,0,0,0,0,0,0,0,0,0,0,0
Pidex yg suka bash penipu lelang acc masih hidup? Yang dulu kek jijik sama jualan apps eh sekarang malah dia yg jualan apps :V mending lu jilat telapak kaki gue aja dex',0,1,0,0,0,0,0,0,0,0,0,0
USER Kalau begitu kenapa ijin sekolah swasta tidak keluar pak dedi di purwakarta?\nUntuk yang yayasannya kristen khususnya.\n\nKan hak seluruh rakyat dengan agama apapun.\n\nSalam damai.\n\n~ems~',0,0,0,0,0,0,0,0,0,0,0,0
Abis kerja pkl 11 sampai sekarang tk blk rmh nasib bujang kalau dah kawin mampus bini aku sangsi kata aku tido rmh bini no 2 haha',0,1,0,0,0,0,0,0,0,0,0,0
USER USER Daripada jilat pantat rijik kaya elu.',1,1,1,0,0,0,0,0,1,1,0,0
"USER Pmain malaysia dri awal ga terpngaruh laga dgn label ""big match"" ""gengsi"" atau ""harga diri bangsa"" jadi bisa fokus bermain, beda dgn kita yg justru terbebani dgn label2 diatas,, semoga di piala asia timnas bisa lebih baik'",0,0,0,0,0,0,0,0,0,0,0,0
pagi2 buka twatter dan ada salebtuit nulis suami jadi cami buahahaha kntl lsng unfollow',0,1,0,0,0,0,0,0,0,0,0,0
6. Anda akn mndptkan pesan Notifikasi rahasia u/ dtukarkn dg Tiket msuk. Pnukaran hnya bs dlkukan d Stadion mlai 6 jam s/d 1 jam sblm kickoff d loket khusus TCash; ; 7. Pstikan Anda mmliki TCash u/ bs mngakses diskon2 khsus smpai 20%. TCash hnya bs dgnakan,0,0,0,0,0,0,0,0,0,0,0,0
"Mereka orang-orang musyrik menjadikan jin sebagai sekutu-sekutu Allah, padahal Allah yang menciptakan jin-jin itu (QS 6;100)",0,0,0,0,0,0,0,0,0,0,0,0
sebenernya gw males sih pake kacamata karena ya BERATTT seharian lu pake gituan di muka. tapi gapapa juga sih heee bisa meminimalisir mata gw yang agak sipit...',0,0,0,0,0,0,0,0,0,0,0,0
USER USER \xc2\xab mandi gua mah emg buaya jaga mandi.',0,0,0,0,0,0,0,0,0,0,0,0
pingin ngobelin memek kamu sambil aku jilatin klitnya hhhmmm',0,1,0,0,0,0,0,0,0,0,0,0
"Ntah politik ntah kafir. Ilmu nyaa gabisa bisa di pahami manusia. ""Kalo anda bertanya dimana rumah Allah? Jawabannnya Allah Ada di dalam tubuh Kita""'",0,0,0,0,0,0,0,0,0,0,0,0
"USER Habis baca ini aku takut karena aku merasa 'insecure attachment' both ambivient dan disorganized ada dalam diri aku. Jadi aku cacat ya? Aku harus gimana untuk memperbaiki itu ka phoerange? Bagaimana ka USER menghadapi itu semua?""",0,0,0,0,0,0,0,0,0,0,0,0
Melepaskan orang yang kamu cintai jauh lebih sulit dibanding menerima cinta yang baru yang asing bagi hatimu.#RobotBijak ##BotZidanCreative',0,0,0,0,0,0,0,0,0,0,0,0
USER USER dan yang takut dengan adzan adalah IBLIS',0,0,0,0,0,0,0,0,0,0,0,0
RT USER SBY ke 2..nnti pura pura jadi yang paling tersakiti..,1,0,1,0,0,0,0,0,1,1,0,0
Si USER ini paling punya mantan aja kaga. Pacaran belom pernah sok-sok bikin thread tipu daya laki-laki. Malu ama titit.',1,1,1,0,0,0,0,1,0,1,0,0
"USER PRD itu komunis apa bukan,,,????'",0,0,0,0,0,0,0,0,0,0,0,0
Belumlah habis galau pak jokowi ditinggal kawin raisa. Kekalahan 2019 sudah di depan mata. Wkwkwk,1,0,1,0,0,0,0,0,1,1,0,0
"\xe2\x80\x9cPada pagi hari, di antara hambaKu ada yang beriman kepadaKu dan ada yang kafir. Siapa yang mengatakan \xe2\x80\x99Muthirna bi fadhlillahi wa rohmatih\xe2\x80\x99 (Kita diberi hujan karena karunia dan rahmat Allah), maka dialah yang beriman ke",0,0,0,0,0,0,0,0,0,0,0,0
RT USER: USER tolol itu banyak yg bela penista agama walau sudah tersangka,1,1,0,1,1,0,0,0,0,0,1,0
USER Kalau cinta; Sudah direkayasa; Banyak bocah disulapnya dewasa; Budi yang kaya; Adat budaya; Tak lagi terjaga ð??¶,0,0,0,0,0,0,0,0,0,0,0,0
Memang iblis punya perangai yang buat kucing macam tu zzzzzzzz tak sanggup aku tgk \xf0\x9f\x98\xad',0,1,0,0,0,0,0,0,0,0,0,0
"USER Keduluan sm China, produksi cangkul, traktor, penyemprot hama, genset dll \xf0\x9f\x98\x82'",0,0,0,0,0,0,0,0,0,0,0,0
USER USER USER USER USER USER USER USER USER USER USER USER Keluargaku yg Katholik ajaa paham.. dia gak paham kan lucu kak\xf0\x9f\x98\x82\xf0\x9f\x98\x82',0,0,0,0,0,0,0,0,0,0,0,0
USER udh pernah diketekin onta belom bang?\n\nga jawab sombong',1,1,1,0,0,0,0,0,1,1,0,0
"USER USER Yang ngeles mulu bukanya lo cebong kapir haha otak gak nyampe, salah nangkep kalimat, ngata2in islam. Kebanyakan ngeles nih cebong kapir intoleran, sara, munafik, pemakan taik ahok peminum rendeman kolor oplos kencing onta hahaha'",1,1,1,0,1,0,0,0,0,1,0,0
dya pintar klaw lgy bego',0,1,0,0,0,0,0,0,0,0,0,0
di masa rezim jokowi aku bisa twoshoot sama yona 2 kali',0,0,0,0,0,0,0,0,0,0,0,0
